sira,sure,ayet,metin,hoca
1049,7,95,"and then did we give them, in exchange for evil, good, until they increased and said, 'Distress and joy both touched our fathers;' then we overtook them suddenly ere they could perceive. -",E. Henry Palmer
1050,7,96,"Had the people of the town but believed and feared, we would have opened up for them blessings from the heavens and from the earth; but they said it was a lie, so we overtook them for that which they had earned.",E. Henry Palmer
1051,7,97,"Were the people of these cities then secure that our violence would not come on them by night, while they slept?",E. Henry Palmer
1052,7,98,were the people of these cities secure that our violence would not come on them in the morning whilst they played?,E. Henry Palmer
1053,7,99,were they secure from the craft of God? none feel secure from the craft of God except a people that shall lose.,E. Henry Palmer
1054,7,100,"Is it not shown to those who inherit the earth after its (former) people, that, did we please, we would smite them in their sins, and would set a stamp upon their hearts, and then they should not hear?",E. Henry Palmer
1055,7,101,"These cities, we do relate to thee their stories. There came to them our apostles with manifest signs; but they did not at all believe in what they called a lie before.- Thus doth God set a stamp upon the hearts of those who misbelieve.",E. Henry Palmer
1056,7,102,Nor did we find in most of them a covenant; but we did find most of them workers of abomination.,E. Henry Palmer
1057,7,103,"Then we raised up after them Moses with our signs to Pharaoh and his chiefs; but they dealt unjustly therewith, and see what was the end of the evildoers!",E. Henry Palmer
1058,7,104,"Moses said, 'O Pharaoh! verily, I am an apostle from the Lord of the worlds;",E. Henry Palmer
1059,7,105,it is not right for me to speak against God aught but the truth. I have come to you with a manifest sign from my Lord; send then the children of Israel with me.',E. Henry Palmer
1060,7,106,"Said he, 'If thou hast come with a sign, then bring it, if thou art of those who speak the truth. '",E. Henry Palmer
1061,7,107,"Then he threw his rod down, and lo! it was an obvious snake;",E. Henry Palmer
1062,7,108,"and he drew out his hand, and lo! it was white to the beholders.",E. Henry Palmer
1063,7,109,"Said the chiefs of Pharaoh's people, 'Verily, this is surely a knowing magician;",E. Henry Palmer
1064,7,110,he desires to turn you out of your land; - what is it then ye bid?',E. Henry Palmer
1065,7,111,"They said, 'Give him and his brother some hope; and send into the cities to collect",E. Henry Palmer
1066,7,112,and bring you every knowing magician. ',E. Henry Palmer
1067,7,113,"And the magician came to Pharaoh and said, 'Is there indeed a reward for us if we are conquerors?'",E. Henry Palmer
1068,7,114,"He said, 'Yea! and ye shall be of those who draw nigh unto me. '",E. Henry Palmer
1069,7,115,"They said, 'O Moses! wilt thou cast down (thy rod) or shall we be (first) to throw?'",E. Henry Palmer
1070,7,116,"Said he, 'Throw down;' and when they threw down, they did enchant the people's eyes, and made them dread, and brought a mighty magic.",E. Henry Palmer
1071,7,117,"But we inspired Moses (saying), 'Throw down thy rod, and it will gulp down that which they devise;'",E. Henry Palmer
1072,7,118,"and the truth stood fast, and vain was that which they had done;",E. Henry Palmer
1073,7,119,"and they were conquered there, and turned back feeling small!",E. Henry Palmer
1074,7,120,and the magicians threw themselves down adoring.,E. Henry Palmer
1075,7,121,"Said they, 'We believe in the Lord of the worlds,",E. Henry Palmer
1076,7,122,the Lord of Moses and Aaron!',E. Henry Palmer
1077,7,123,"Said Pharaoh, 'Do ye believe in him ere I give you leave? This is craft which ye have devised in the land, to turn its people out therefrom, but soon shall ye know!",E. Henry Palmer
1078,7,124,"I will cut off your hands and your feet from opposite sides, then I will crucify you altogether!'",E. Henry Palmer
1079,7,125,"They said, 'Verily, we unto our Lord return!",E. Henry Palmer
1080,7,126,"nor dost thou take vengeance on us, save for that we believe in the signs of our Lord, when they come to us. 'O our Lord! pour out upon us patience, and take us to Thyself resigned.'",E. Henry Palmer
1081,7,127,"And the chiefs of Pharaoh's people said, 'Will ye leave Moses and his people, to do evil in the land, and to leave thee and thy gods?' Said he, 'We will have their sons slain and their women we will let live, for, verily, we are triumphant over them. '",E. Henry Palmer
1082,7,128,"Said Moses unto his people, 'Ask for aid from God and be patient; verily, the earth is Gods! He gives it for an inheritance to whom He pleases of His servants, and the future is for those who fear. '",E. Henry Palmer
1083,7,129,"They said, 'We have been hurt before thou didst come to us, and since thou hast come to us. ' Said he, 'It may be that your Lord will destroy your foe, and will make you succeed him in the earth; and He will see how ye act.'",E. Henry Palmer
1084,7,130,"We had overtaken Pharaoh's people with the years (of dearth) and scarcity of fruits, that haply they might remember;",E. Henry Palmer
1085,7,131,"but when there came to them a good thing they said, 'This is ours;' and if there befell them an evil, they took the augury from Moses and those with him; - is not their augury only in God's hands? - but most of them know not.",E. Henry Palmer
1086,7,132,"And they said, 'Whatever thou dost bring us as a sign to enchant us therewith, yet will we not believe in thee. '",E. Henry Palmer
1087,7,133,"Then we sent upon them the flood and the locusts and the lice and the frogs and the blood, - signs detailed; but they were big with pride and were a people who did sin.",E. Henry Palmer
1088,7,134,"And when there fell upon them the plague, they said, 'O Moses! call upon thy Lord for us, as He has covenanted with thee; verily, if thou dost remove the plague from us, we will believe in thee; and we will assuredly send with thee the children of Israel. '",E. Henry Palmer
1089,7,135,"But when we removed from them the plague until the appointed time which they should reach, lo! then they broke their promise.",E. Henry Palmer
1090,7,136,"But we took vengeance on them, and we drowned them in the sea, for that they said our signs were lies and were careless thereof.",E. Henry Palmer
1091,7,137,"And we gave as an inheritance unto the people who had been weak, the eastern quarters of the earth and the western quarters thereof, which we had blest; and the good word of thy Lord was fulfilled on the children of Israel, for that they were patient; and we destroyed that which Pharaoh and his people had made and that which they had piled.",E. Henry Palmer
1092,7,138,"And with the children of Israel we passed across the sea; and they came unto a people devoted to their idols, and said, 'O Moses! make for us a god as they have gods. ' Said he, 'Verily, ye are ignorant people.'",E. Henry Palmer
1093,7,139,"Verily, these - destroyed shall be that which they are given to; and vain is that which they have done.",E. Henry Palmer
1094,7,140,"He said, 'Other than God then do ye crave for a god, when He has preferred you above the worlds?'",E. Henry Palmer
1095,7,141,"And when we saved you from Pharaoh's people who wrought you evil woe, killing your sons, and letting your women live; and in that was a mighty trial from your Lord.",E. Henry Palmer
1096,7,142,"And we appointed for Moses thirty nights, and completed them with ten (more), so that the time appointed by his Lord was completed to forty nights. And Moses said unto his brother Aaron, 'Be thou my vicegerent amongst my people, and do what is right, and follow not the path of the evildoers.'",E. Henry Palmer
1097,7,143,"And when Moses came to our appointment, and his Lord spake unto him, he said, 'O my Lord! show me, - that I may look on thee!' He said, Thou canst not see me; but look upon the mountain, and if it remain steady in its place, thou shalt see me;' but when his Lord appeared unto the mountain He made it dust, and Moses fell down in a swoon! And when he came to himself, he said, 'Celebrated be thy praise! I turn repentant unto Thee, and I am the first of those who are resigned. '",E. Henry Palmer
1098,7,144,"He said, 'O Moses! verily, I have chosen thee over the people with my messages and my words, take then what I have brought thee, and be of those who thank. '",E. Henry Palmer
1099,7,145,"And we wrote for him upon tablets an admonition concerning everything, and a detailing of everything: 'Take them then with firmness, and bid thy people take them for what is best thereof. I will show you the abode of those who work abominations;",E. Henry Palmer
1100,7,146,"I will turn from my signs those who are big with pride in the earth without right; and if they see every sign they shall not believe therein, and if they see the path of rectitude they shall not take it for a path; but if they see the path of error they shall take it for a path; - that is because they have said our signs are lies and have been careless of them. '",E. Henry Palmer
1101,7,147,"But those who say our signs and the meeting of the last day are lies, -- vain are their works: shall they be rewarded save for that which they have done?",E. Henry Palmer
1102,7,148,"And Moses' people after him took to themselves of their ornaments a corporeal calf that lowed; did they not see that it could not speak with them, nor could it guide them in the path? They took it and they were unjust;",E. Henry Palmer
1103,7,149,"but when they bit their hands with fruitless rage and saw that they had gone astray, they said,' Verily, if our Lord have not compassion on us and forgive us we shall surely be of those who lose!'",E. Henry Palmer
1104,7,150,"And when Moses returned unto his people angry and grieved, he said, 'Evil is it that ye have done after me! Would ye hasten on the bidding of your Lord?' and he threw down the tablets and took his brother by the head to drag him towards him, but he said, 'O son of my mother! verily, the people weakened me and well-nigh killed me; make not then mine enemies glad about me, and put me not with the unjust people. '",E. Henry Palmer
1105,7,151,"He said, 'O Lord! pardon me and my brother, and let us enter into Thy mercy; for Thou art the most merciful of the merciful.",E. Henry Palmer
1106,7,152,"Verily, these have taken to themselves a calf; there shall reach them wrath from their Lord, and abasement in the life of this world; for thus do we reward those who forge a lie.",E. Henry Palmer
1107,7,153,"But those who have done bad works, and then turn again after them and believe,- verily, thy Lord, after that, is forgiving and merciful. '",E. Henry Palmer
1108,7,154,"And when Moses' wrath calmed down he took the tables, in the inscription of which was guidance and mercy for those who dread their Lord.",E. Henry Palmer
1109,7,155,"And Moses chose from his people seventy men for our appointment; and when the earthquake took them he said, 'O my Lord! hadst Thou willed, Thou hadst destroyed them before and me. Wilt Thou destroy us for what the fools amongst us have done? This is naught but Thy trial, wherewith Thou dost lead astray whom Thou pleasest and guidest whom Thou pleasest; Thou art our patron! forgive us and have mercy on us, for Thou art the best of those who do forgive!",E. Henry Palmer
1110,7,156,"' And write down for us in this world good, and in the future too; verily, we are guided unto Thee. ' He said, 'My punishment - with it I fall on whom I will; and my mercy embraceth everything; and I will write it down for those who fear, and who give alms, and those who in our signs believe,-",E. Henry Palmer
1111,7,157,"who follow the Apostle - the illiterate prophet, whom they find written down with them in the law and the gospel, bidding them what is reasonable and forbidding them what is wrong, and making lawful for them what is good, and making unlawful evil things; and setting down for them their burdens and the yokes which were upon them; - to those who believe in him and aid him and help him and follow the law which has been sent down with him - they shall be the prosperous. '",E. Henry Palmer
1112,7,158,"Say, 'O ye folk! verily, I am the Apostle of God unto you all' -, of Him whose is the kingdom of the heavens and the earth, there is no god but He! He quickens and He kills! believe then in God and His Apostle, the illiterate prophet,- who believes in God and in His words - then follow him that haply ye may be guided.",E. Henry Palmer
1113,7,159,"Amongst Moses' people is a nation guided in truth, and thereby act they justly.",E. Henry Palmer
1114,7,160,"And we cut them up into twelve tribes, each a nation; and we revealed unto Moses, when his people asked him for drink, 'Strike with thy staff the rock!' and there gushed forth from it twelve springs, each folk knew their drinking place. And we overshadowed them with the cloud; and sent down upon them the manna and the quails, 'Eat of the good things we have provided you with!' - Yet they did not wrong us, but it was themselves they wronged.",E. Henry Palmer
1115,7,161,"And when it was said unto them, 'Dwell in this city and eat therefrom as ye will, and say 'hittatun and enter the gate adoring; so will we pardon you your sins; - we will increase those who do well. '",E. Henry Palmer
1116,7,162,But those amongst them who did wrong changed it for another word than which was said to them; and we sent upon them a plague from heaven for that they were unjust.,E. Henry Palmer
1117,7,163,"Ask them too about the city which stood by the sea, when they transgressed upon the Sabbath; when their fish came to them on the Sabbath day sailing straight up to them; but on the days when they kept not the Sabbath, they came not to them, thus did we try them for the abominations that they wrought.",E. Henry Palmer
1118,7,164,"And when a nation from amongst them said, 'Why do ye warn a people whom God would destroy, or punish with severe torment?' they said, 'As an excuse to your Lord, that haply they may fear. '",E. Henry Palmer
1119,7,165,"But when they forgot what they had been reminded of, we saved those who forbade evil, but we overtook those who did wrong with punishment; - evil was the abomination that they did,",E. Henry Palmer
1120,7,166,"but when they rebelled against what they were forbidden, we said to them, 'Become ye apes, despised and spurned!'",E. Henry Palmer
1121,7,167,"and then thy Lord proclaimed that He would surely send against them till the resurrection day, those who should wreak them evil torment; verily, thy Lord is quick at following up, but, verily, He is forgiving, merciful.",E. Henry Palmer
1122,7,168,"We cut them up in the earth into nations. Of them are the righteous, and of them are the reverse of that; we have tried them with good things and with bad things; haply they may return.",E. Henry Palmer
1123,7,169,"But there succeeded them successors who inherited the Book! They take the goods of this lower world and say, 'It will be forgiven us. ' But if the like goods came to them they would take them too! Was there not taken from them a covenant by the Book, that they should not say against God aught but the truth? Yet they study therein! But the abode of the future life is better for those who fear - do ye not then understand?",E. Henry Palmer
1124,7,170,"But those who hold fast by the Book and are steadfast in prayer - verily, we will not waste the hire of those who do right.",E. Henry Palmer
1125,7,171,"And when we shook the mountain over them, as though it were a shadow, and they thought it would fall upon them (saying), 'Take ye what we have given you with firmness, and remember what is therein; haply ye may fear. '",E. Henry Palmer
1126,7,172,"And when thy Lord took from the children of Adam out of their loins their seed, and made them bear witness against themselves, ' Am I not your Lord?' They said, 'Yea! we do bear witness' - lest ye should say on the day of resurrection, 'Verily, for this we did not care;'",E. Henry Palmer
1127,7,173,"or say, 'Verily, our fathers associated others with God before us, and we were but their seed after them: wilt Thou then destroy us for what vaindoers did?' -",E. Henry Palmer
1128,7,174,Thus do we detail the signs; haply they may return.,E. Henry Palmer
1129,7,175,"Read to them the declaration of him to whom we brought our signs, and who stepped away therefrom, and Satan followed him, and he was of those who were beguiled.",E. Henry Palmer
1130,7,176,"Had we pleased we would have exalted him thereby, but lie crouched upon the earth and followed his lust, and his likeness was as the likeness of a dog, whom if thou shouldst attack he hangs out his tongue, or if thou should leave him, hangs out his tongue too. That is the likeness of the people who say our signs are lies. Tell them then these tales - haply they may reflect.",E. Henry Palmer
1131,7,177,Evil is the likeness of a people who say our signs are lies; themselves it is they wrong!,E. Henry Palmer
1132,7,178,????,E. Henry Palmer
1133,7,179,"We have created for hell many of the ginn and of mankind; they have hearts and they discern not therewith; they have eyes and they see not therewith; they have ears and they hear not therewith; they are like cattle, nay, they go more astray! these it is who care not.",E. Henry Palmer
1134,7,180,"But God's are the good names; call on Him then thereby, and leave those who pervert His names; they shall be rewarded for that which they have done.",E. Henry Palmer
1135,7,181,And of those whom we have created is a nation who are guided in truth and thereby act with equity;,E. Henry Palmer
1136,7,182,"but they who say our signs are lies, we will bring them down by degrees from whence they know not.",E. Henry Palmer
1137,7,183,"I will let them range; - verily, my stratagem is efficacious!",E. Henry Palmer
1138,7,184,Do they not then reflect that their companion is not possessed? he is but an obvious warner!,E. Henry Palmer
1139,7,185,"Do they not behold the kingdoms of the heavens and of the earth, and what things God has created, and (see that), it may be, their time is already drawing nigh? in what relation then will they believe?",E. Henry Palmer
1140,7,186,"He whom God leads astray there is no guide for him! He leaves them in their rebellion, blindly wandering on.",E. Henry Palmer
1141,7,187,"They will ask you about the Hour, for what time it is fixed? - say, 'The knowledge thereof is only with my Lord; none shall manifest it at its time but He; it is heavy in the heavens and the earth, it will not come to you save on a sudden. ' They will ask as though thou wert privy to it, say, 'The knowledge thereof is only with God,' - but most folk do not know.",E. Henry Palmer
1142,7,188,"Say, 'I cannot control profit or harm for myself, save what God will. If I knew the unseen I should surely have much that is good, nor would evil touch me; I am but a warner and a herald of good tidings unto a people who believe.'",E. Henry Palmer
1143,7,189,"He it is who created you from one soul, and made therefrom its mate to dwell therewith; and when he covered her she bore a light burden and went about therewith; but when it grew heavy they called on God, Lord of them both, 'Surely if thou givest us a rightly-shaped child we shall of a surety be of those who thank. '",E. Henry Palmer
1144,7,190,"And when He gave them both a rightly-shaped child they joined partners with Him for that which He had given them, but exalted be God above that which they associate with Him.",E. Henry Palmer
1145,7,191,"Will they associate with Him those who cannot create aught, but are themselves created,",E. Henry Palmer
1146,7,192,"which have no power to help them, and cannot even help themselves?",E. Henry Palmer
1147,7,193,But if ye call them unto guidance they will not follow you. It is the same to them if Thou dost call them or if Thou dost hold thy tongue.,E. Henry Palmer
1148,7,194,"Those whom ye call on other than God are servants like yourselves. Call on them then, and let them answer you, if so be ye tell the truth!",E. Henry Palmer
1149,7,195,"Have they feet to walk with? or have they hands to hold with? or have they eyes to see with? or have they ears to hear with? Call upon your partners; then plot against me, and do not wait.",E. Henry Palmer
1150,7,196,"Verily, my patron is God, who hath sent down the Book, and He is the patron of the righteous.",E. Henry Palmer
1151,7,197,"But those whom ye call on beside Him cannot help you, nor can they even help themselves.",E. Henry Palmer
1152,7,198,"But if ye call them unto the guidance they will not hear, thou mayest see them looking towards thee, yet they do not see.",E. Henry Palmer
1153,7,199,"Take to pardon, and order what is kind, and shun the ignorant;",E. Henry Palmer
1154,7,200,"and if an incitement from the devil incites you, then seek refuge in God: verily, He both hears and knows.",E. Henry Palmer
1155,7,201,"Verily, those who fear God, if a wraith from the devil touch, mention Him, and lo! they see.",E. Henry Palmer
1156,7,202,"And their brethren he shall increase in error, then they shall not desist.",E. Henry Palmer
1157,7,203,"Shouldst Thou not bring them a sign they say, 'Hast Thou not yet made choice of one?' Say, 'I only follow what is inspired to me by my Lord. These are perceptions from my Lord, and a guidance and a mercy to a people who believe.'",E. Henry Palmer
1158,7,204,"And when the Qur'an is read, then listen thereto and keep silence; haply ye may obtain mercy.",E. Henry Palmer
1159,7,205,"And remember thy Lord within thyself humbly and with fear, not openly in words, in the morning and in the evening; and be not of those who do not care.",E. Henry Palmer
1160,7,206,"Verily, they who are with my Lord are not too big with pride for His service, but they do celebrate His praise, and Him they do adore.",E. Henry Palmer
1161,8,1,"They will ask thee about the spoils. Say, 'The spoils are God's and the Apostle's; fear God and settle it amongst yourselves; obey God and the Apostle if ye do believe.'",E. Henry Palmer
1162,8,2,"Verily, the believers are those who, when God's name is mentioned, their hearts sink with fear; and when His signs are rehearsed to them they increase them in faith; and on their Lord do they rely;",E. Henry Palmer
1163,8,3,"who are steadfast in prayer, and of what we have bestowed upon them give in alms;",E. Henry Palmer
1164,8,4,"these are in truth believers; to them are degrees with their Lord, and forgiveness, and a generous provision.",E. Henry Palmer
1165,8,5,"As thy Lord caused thee to go forth from thy house with the truth, although a sect of the believers were averse therefrom.",E. Henry Palmer
1166,8,6,"They wrangled with thee about the truth after it was made plain, as though they were being driven on to death and looked thereon;",E. Henry Palmer
1167,8,7,"and when God promised you that one of the two troops should be yours, and ye would fain have had those who had no arms. God wished to prove the truth true by His words, and to cut off the hindermost parts of those who misbelieve -",E. Henry Palmer
1168,8,8,"to prove the truth true, and to make vain the vain, although the sinners are averse.",E. Henry Palmer
1169,8,9,"When ye asked for succour from your Lord, and He answered you, 'I will assist you with a thousand angels, with others in reserve. '",E. Henry Palmer
1170,8,10,"God made it only glad tidings to quiet your hearts therewith; for victory is only from God! verily, God is mighty and wise.",E. Henry Palmer
1171,8,11,"When drowsiness covered you as a security from Him, and He sent down upon you from the heavens water to purify you withal, and to take away from you the plague of Satan, and to tie up your hearts and to make firm your footsteps.",E. Henry Palmer
1172,8,12,"When your Lord inspired the angels - 'Verily, I am with you; make ye firm then those who believe; I will cast dread into the hearts of those who misbelieve,- strike off their necks then, and strike off from them every finger tip. '",E. Henry Palmer
1173,8,13,"That is, because they went into opposition against God and His Apostle; for he who goes into opposition against God and His Apostle - verily, God is keen to punish.",E. Henry Palmer
1174,8,14,"There, taste it! since for the misbelievers is the torment of the Fire.",E. Henry Palmer
1175,8,15,"O ye who believe! when ye meet those who misbelieve in swarms, turn not to them your hinder parts;",E. Henry Palmer
1176,8,16,"for he who turns to them that day his hinder parts, save turning to fight or rallying to a troop, brings down upon himself wrath from God, and his resort is hell, and an ill journey shall it be!",E. Henry Palmer
1177,8,17,"Ye did not slay them, but it was God who slew them; nor didst thou shoot when thou didst shoot, but God did shoot, to try the believers from Himself with a goodly trial; verily, God both hears and knows.",E. Henry Palmer
1178,8,18,"There! verily, God weakens the stratagem of the misbelievers.",E. Henry Palmer
1179,8,19,"If ye wish the matter to be decided, a decision has now come to you; but if ye desist, it is better for you; and if ye turn back we will turn too, and your troop shall avail nothing, great in number though it be, since God is with the believers!",E. Henry Palmer
1180,8,20,"O ye who believe! obey God and His Apostle, and turn not from Him while ye hear,",E. Henry Palmer
1181,8,21,"and be not like those who say, 'We hear,' and yet they hear not.",E. Henry Palmer
1182,8,22,"Verily, the worst of beasts in God's sight are the deaf, the dumb who do not understand.",E. Henry Palmer
1183,8,23,"Had God known any good in them, He would have made them hear; but had He made them hear, they would have turned back and have swerved aside.",E. Henry Palmer
