sira,sure,ayet,metin,hoca
1,1,1,IN the name of the merciful and compassionate God.,E. Henry Palmer
2,1,2,"Praise belongs to God, the Lord of the worlds,",E. Henry Palmer
3,1,3,"the merciful, the compassionate,",E. Henry Palmer
4,1,4,the ruler of the day of judgment!,E. Henry Palmer
5,1,5,Thee we serve and Thee we ask for aid.,E. Henry Palmer
6,1,6,"Guide us in the right path,",E. Henry Palmer
7,1,7,the path of those Thou art gracious to; not of those Thou art wroth with; nor of those who err.,E. Henry Palmer
8,2,1,ALIF LAM MIM.,E. Henry Palmer
9,2,2,"That is the book! there is no doubt therein; a guide to the pious,",E. Henry Palmer
10,2,3,"who believe in the unseen, and are steadfast in prayer, and of what we have given them expend in alms;",E. Henry Palmer
11,2,4,"who believe in what is revealed to thee, and what was revealed before thee, and of the hereafter they are sure.",E. Henry Palmer
12,2,5,"These are in guidance from their Lord, and these are the prosperous.",E. Henry Palmer
13,2,6,"Verily, those who misbelieve, it is the same to them if ye warn them or if ye warn them not, they will not believe.",E. Henry Palmer
14,2,7,"God has set a seal upon their hearts and on their hearing; and on their eyes is dimness, and for them is grievous woe.",E. Henry Palmer
15,2,8,"And there are those among men who say, 'We believe in God and in the last day;' but they do not believe.",E. Henry Palmer
16,2,9,They would deceive God and those who do believe; but they deceive only themselves and they do not perceive.,E. Henry Palmer
17,2,10,"In their hearts is a sickness, and God has made them still more sick, and for them is grievous woe because they lied.",E. Henry Palmer
18,2,11,"And when it is said to them, 'Do not evil in the earth,' they say, 'We do but what is right. '",E. Henry Palmer
19,2,12,Are not they the evildoers? and yet they do not perceive.,E. Henry Palmer
20,2,13,"And when it is said to them, 'Believe as other men believe,' they say, 'Shall we believe as fools believe?' Are not they themselves the fools? and yet they do not know.",E. Henry Palmer
21,2,14,"And when they meet those who believe, they say, 'We do believe;' but when they go aside with their devils, they say, 'We are with you; we were but mocking!'",E. Henry Palmer
22,2,15,"God shall mock at them and let them go on in their rebellion, blindly wandering on.",E. Henry Palmer
23,2,16,"Those who buy error for guidance, their traffic profits not, and they are not guided.",E. Henry Palmer
24,2,17,"Their likeness is as the likeness of one who kindles a fire; and when it lights up all around, God goes off with their light, and leaves them in darkness that they cannot see.",E. Henry Palmer
25,2,18,"Deafness, dumbness, blindness, and they shall not return!",E. Henry Palmer
26,2,19,"Or like a storm-cloud from the sky, wherein is darkness and thunder and lightning; they put their fingers in their ears at the thunder-clap, for fear of death, for God encompasses the misbelievers.",E. Henry Palmer
27,2,20,"The lightning well-nigh snatches off their sight, whenever it shines for them they walk therein; but when it is dark for them they halt; and if God willed He would go off with their hearing and their sight; verily, God is mighty over all.",E. Henry Palmer
28,2,21,O ye folk! serve your Lord who created you and those before you; haply ye may fear!,E. Henry Palmer
29,2,22,"who made the earth for you a bed and the heaven a dome; and sent down from heaven water, and brought forth therewith fruits as a sustenance for you; so make no peers for God, the while ye know!",E. Henry Palmer
30,2,23,"And if ye are in doubt of what we have revealed unto our servant, then bring a chapter like it, and call your witnesses other than God if ye tell truth.",E. Henry Palmer
31,2,24,"But if ye do it not, and ye shall surely do it not, then fear the fire whose fuel is men and stones, prepared for misbelievers.",E. Henry Palmer
32,2,25,"But bear the glad tidings to those who believe and work righteousness, that for them are gardens beneath which rivers flow; whenever they are provided with fruit therefrom they say, 'This is what we were provided with before,' and they shall be provided with the like; and there are pure wives for them therein, and they shall dwell therein for aye.",E. Henry Palmer
33,2,26,"Why, God is not ashamed to set forth a parable of a gnat, or anything beyond; and as for those who believe, they know that it is truth from the Lord; but as for those who disbelieve, they say, 'What is it that God means by this as a parable? He leads astray many and He guides many;' - but He leads astray only the evildoers;",E. Henry Palmer
34,2,27,"who break God's covenant after the fixing thereof, and cut asunder what God has ordered to be joined, and do evil in the earth;- these it is who lose.",E. Henry Palmer
35,2,28,"How can ye disbelieve in God, when ye were dead and He made you alive, and then He will kill you and then make you alive again, and then to Him will ye return?",E. Henry Palmer
36,2,29,"It is He who created for you all that is in the earth, then he made for the heavens and fashioned them seven heavens; and He knows all things.",E. Henry Palmer
37,2,30,"And when thy Lord said unto the angels, 'I am about to place a vicegerent in the earth,' they said, 'Wilt Thou place therein one who will do evil therein and shed blood? we celebrate Thy praise and hallow Thee. ' Said (the Lord), 'I know what ye know not.'",E. Henry Palmer
38,2,31,"And He taught Adam the names, all of them; then He propounded them to the angels and said, 'Declare to me the names of these, if ye are truthful. '",E. Henry Palmer
39,2,32,"They said, 'Glory be to Thee! no knowledge is ours but what Thou thyself hast taught us, verily, Thou art the knowing, the wise. '",E. Henry Palmer
40,2,33,"Said the Lord, 'O Adam declare to them their names;' and when he had declared to them their names He said, Did I not say to you, I know the secrets of the heavens and of the earth, and I know what ye show and what ye were hiding?'",E. Henry Palmer
41,2,34,"And when we said to the angels, 'Adore Adam,' they adored him save only Iblis, who refused and was too proud and became one of the misbelievers.",E. Henry Palmer
42,2,35,"And we said, 'O Adam dwell, thou and thy wife, in Paradise, and eat therefrom amply as you wish; but do not draw near this tree or ye will be of the transgressors.",E. Henry Palmer
43,2,36,"And Satan made them backslide therefrom and drove them out from what they were in, and we said, 'Go down, one of you the enemy of the other, and in the earth there is an abode and a provision for a time. '",E. Henry Palmer
44,2,37,"And Adam caught certain words from his Lord, and He turned towards him, for He is the compassionate one easily turned.",E. Henry Palmer
45,2,38,"We said, 'Go down therefrom altogether and haply there may come from me a guidance, and whoso follows my guidance, no fear is theirs, nor shall they grieve.",E. Henry Palmer
46,2,39,"But those who misbelieve, and call our signs lies, they are the fellows of the Fire, they shall dwell therein for aye. '",E. Henry Palmer
47,2,40,O ye children of Israel! remember my favours which I have favoured you with; fulfil my covenant and I will fulfil your covenant; me therefore dread.,E. Henry Palmer
48,2,41,"Believe in what I have revealed, verifying what ye have got, and be not the first to disbelieve in it, and do not barter my signs for a little price, and me do ye fear.",E. Henry Palmer
49,2,42,"Clothe not truth with vanity, nor hide the truth the while ye know.",E. Henry Palmer
50,2,43,"Be steadfast in prayer, give the alms, and bow down with those who bow.",E. Henry Palmer
51,2,44,"Will ye order men to do piety and forget yourselves? ye read the Book, do ye not then understand?",E. Henry Palmer
52,2,45,"Seek aid with patience and prayer, though it is a hard thing save for the humble,",E. Henry Palmer
53,2,46,"who think that they will meet their Lord, and that to Him will they return.",E. Henry Palmer
54,2,47,"O ye children of Israel! remember my favours which I have favoured you with, and that I have preferred you above the worlds.",E. Henry Palmer
55,2,48,"Fear the day wherein no soul shall pay any recompense for another soul, nor shall intercession be accepted for it, nor shall compensation be taken from it, nor shall they be helped.",E. Henry Palmer
56,2,49,"When we saved you from Pharaohs people who sought to wreak you evil and woe, slaughtering your sons and letting your women live; in that was a great trial for you from your Lord.",E. Henry Palmer
57,2,50,When we divided for you the sea and saved you and drowned Pharaohs people while ye looked on.,E. Henry Palmer
58,2,51,"When we treated with Moses forty nights, then ye took the calf after he had gone and ye did wrong.",E. Henry Palmer
59,2,52,Yet then we forgave you after that; perhaps ye may be grateful.,E. Henry Palmer
60,2,53,And when we gave Moses the Scriptures and the Discrimination; perhaps ye will be guided.,E. Henry Palmer
61,2,54,"When Moses said to his people, 'O my people! Ye have wronged yourselves in taking this calf; repent unto your Creator and kill each other; that will be better for you in your Creators eyes; and He turned unto you, for He is the compassionate one easily turned. '",E. Henry Palmer
62,2,55,"And when ye said to Moses, 'O Moses! we will not believe in thee until we see God manifestly,' and the thunderbolt caught you while ye yet looked on.",E. Henry Palmer
63,2,56,Then we raised you up after your death; perhaps ye may be grateful.,E. Henry Palmer
64,2,57,"And we overshadowed you with the cloud, and sent down the manna and the quails; 'Eat of the good things we have given you. ' They did not wrong us, but it was themselves they were wronging.",E. Henry Palmer
65,2,58,"And when we said, 'Enter this city and eat therefrom as plentifully as ye wish; and enter the gate worshipping and say 'hittatun. So will we pardon you your sins and give increase unto those who do well.'",E. Henry Palmer
66,2,59,"But those who did wrong changed it for another word than that which was said to them: and we sent down upon those who did wrong, wrath from heaven for that they had so sinned.",E. Henry Palmer
67,2,60,"When Moses, too, asked drink for his people and we said, 'Strike with thy staff the rock,' and from it burst forth twelve springs; each man among them knew his drinking place. 'Eat and drink of what God has provided, and transgress not on the earth as evildoers.'",E. Henry Palmer
68,2,61,"And when they said, 'O Moses, we cannot always bear one kind of food; pray then thy Lord to bring forth for us of what the earth grows, its green herbs, its cucumbers, its garlic, its lentils, and its onions. ' Said he, 'Do ye ask what is meaner instead of what is best? Go down to Egypt,- there is what ye ask.' Then were they smitten with abasement and poverty, and met with wrath from God. That was because they had misbelieved in God's signs and killed the prophets undeservedly; that was for that they were rebellious and had transgressed.",E. Henry Palmer
69,2,62,"Verily, whether it be of those who believe, or those who are Jews or Christians or Sabaeans, whosoever believe in God and the last day and act aright, they have their reward at their Lords hand, and there is no fear for them, nor shall they grieve.",E. Henry Palmer
70,2,63,"And when we took a covenant with you and held the mountain over you; ' Accept what we have brought you with strong will, and bear in mind what is therein, haply ye yet may fear. '",E. Henry Palmer
71,2,64,"Then did ye turn aside after this, and were it not for God's grace towards you and His mercy, ye would have been of those who lose.",E. Henry Palmer
72,2,65,"Ye know too of those among you who transgressed upon the Sabbath, and we said, 'Become ye apes, despised and spurned. '",E. Henry Palmer
73,2,66,"Thus we made them an example unto those who stood before them, and those who should come after them, and a warning unto those who fear.",E. Henry Palmer
74,2,67,"And when Moses said to his people, 'God bids you slaughter a cow,' they said, 'Art thou making a jest of us?' Said he, 'I seek refuge with God from being one of the unwise. '",E. Henry Palmer
75,2,68,"They said, 'Then pray thy Lord for us to show us what she is to be. ' He answered, 'He saith it is a cow, nor old, nor young, of middle age between the two; so do as ye are bid.'",E. Henry Palmer
76,2,69,"They said, 'Pray now thy Lord to show us what her colour is to be. ' He answered, 'He saith it is a dun cow, intensely dun, her colour delighting those who look upon her.'",E. Henry Palmer
77,2,70,"Again they said, 'Pray thy Lord to show us what she is to be; for cows appear the same to us; then we, if God will, shall be guided. '",E. Henry Palmer
78,2,71,"He answered, 'He saith, it is a cow, not broken in to plough the earth or irrigate the tilth, a sound one with no blemish on her. ' They said, 'Now hast thou brought the truth.' And they slaughtered her, though they came near leaving it undone.",E. Henry Palmer
79,2,72,"When too ye slew a soul and disputed thereupon, and God brought forth that which ye had hidden,",E. Henry Palmer
80,2,73,"then we said, 'Strike him with part of her. ' Thus God brings the dead to life and shows you His signs, that haply ye may understand.",E. Henry Palmer
81,2,74,"Yet were your hearts hardened even after that, till they were as stones or harder still, for verily of stones are some from which streams burst forth, and of them there are some that burst asunder and the water issues out, and of them there are some that fall down for fear of God; but God is never careless of what ye do.",E. Henry Palmer
82,2,75,"Do ye crave that they should believe you when already a sect of them have heard the word of God and then perverted it after they had understood it, though they knew?",E. Henry Palmer
83,2,76,"And when they meet those who believe they say, 'We believe,' but when one goes aside with another they say, 'Will ye talk to them of what God has opened up to you, that they may argue with you upon it before your Lord? Do ye not therefore understand?'",E. Henry Palmer
84,2,77,Do they not then know that God knoweth what they keep secret and what they make known abroad?,E. Henry Palmer
85,2,78,"And some of them there are, illiterate folk, that know not the Book, but only idle tales; for they do but fancy.",E. Henry Palmer
86,2,79,"But woe to those who write out the Book with their hands and say 'this is from God;' to buy therewith a little price! and woe to them for what their hands have written, and woe to them for what they gain!",E. Henry Palmer
87,2,80,"And then they say, 'Hell fire shall not touch us save for a number of days. ' Say, 'Have ye taken a covenant with God?' but God breaks not His covenant. Or do ye say of God that which ye do not know?",E. Henry Palmer
88,2,81,"Yea! whoso gains an evil gain, and is encompassed by his sins, those are the fellows of the Fire, and they shall dwell therein for aye!",E. Henry Palmer
89,2,82,"But such as act aright, those are the fellows of Paradise, and they shall dwell therein for aye!",E. Henry Palmer
90,2,83,"And when we took from the children of Israel a covenant, saying, 'Serve ye none but God, and to your two parents show kindness, and to your kindred and the orphans and the poor, and speak to men kindly, and be steadfast in prayer, and give alms;' and then ye turned back, save a few of you, and swerved aside.",E. Henry Palmer
91,2,84,"And when we took covenant from you, 'shed ye not your kinsmans blood, nor turn your kinsmen out of their homes:' then did ye confirm it and were witnesses thereto.",E. Henry Palmer
92,2,85,"Yet ye were those who slay your kinsmen and turn a party out of their homes, and back each other up against them with sin and enmity. But if they come to you as captives ye ransom them!- and yet it is as unlawful for you to turn them out. Do ye then believe in part of the Book and disbelieve in part? But the reward of such among you as do that shall be nought else but disgrace in this worldly life, and on the day of the resurrection shall they be driven to the most grievous torment, for God is not unmindful of what ye do.",E. Henry Palmer
93,2,86,"Those who have bought this worldly life with the Future, the torment shall not be lightened from them nor shall they be helped.",E. Henry Palmer
94,2,87,"We gave Moses the Book and we followed him up with other apostles, and we gave Jesus the son of Mary manifest signs and aided him with the Holy Spirit. Do ye then, every time an apostle comes to you with what your souls love not, proudly scorn him, and charge a part with lying and slay a part?",E. Henry Palmer
95,2,88,"They say, 'Our hearts are uncircumcised;' nay, God has cursed them in their unbelief, and few it is who do believe.",E. Henry Palmer
96,2,89,"And when a book came down from God confirming what they had with them, though they had before prayed for victory over those who misbelieve, yet when that came to them which they knew, then they disbelieved it,- God's curse be on the misbelievers.",E. Henry Palmer
97,2,90,"For a bad bargain have they sold their souls, not to believe in what God has revealed, grudging because God sends down of His grace on whomsoever of His servants He will; and they have brought on themselves wrath after wrath and for the misbelievers is there shameful woe.",E. Henry Palmer
98,2,91,"And when they are told to believe in what God has revealed, they say, 'We believe in what has been revealed to us;' but they disbelieve in all beside, although it is the truth confirming what they have. Say, 'Wherefore did ye kill God's prophets of yore if ye were true believers?'",E. Henry Palmer
99,2,92,"Moses came to you with manifest signs, then ye took up with the calf when he had gone and did so wrong.",E. Henry Palmer
100,2,93,"And when we took a covenant with you and raised the mountain over you, 'Take what we have given you with resolution and hear;' they said, 'We hear but disobey;' and they were made to drink the calf down into their hearts for their unbelief. Say, 'An evil thing is it which your belief bids you do, if ye be true believers.'",E. Henry Palmer
101,2,94,"Say, 'If the abode of the future with God is yours alone and not mankinds: long for death then if ye speak the truth. '",E. Henry Palmer
102,2,95,But they will never long for it because of what their hands have sent on before; but God is knowing as to the wrong doers.,E. Henry Palmer
103,2,96,"Why, thou wilt find them the greediest of men for life; and of those who associate others with God one would fain live for a thousand years,- but he will not be reprieved from punishment by being let live, for God seeth what they do.",E. Henry Palmer
104,2,97,"Say, 'Who is an enemy to Gabriel?' for he hath revealed to thy heart, with God's permission, confirmation of what had been before, and a guidance and glad tidings to believers.",E. Henry Palmer
105,2,98,"Who is an enemy to God and His angels and His apostles and Gabriel and Michael?- Verily, God is an enemy to the unbelievers.",E. Henry Palmer
106,2,99,"We have sent down to thee conspicuous signs, and none will disbelieve therein except the evildoers.",E. Henry Palmer
107,2,100,"Or every time they make a covenant, will a part of them repudiate it? Nay, most of them do not believe.",E. Henry Palmer
108,2,101,"And when there comes to them an apostle confirming what they have, a part of those who have received the Book repudiate God's book, casting it behind their backs as though they did not know.",E. Henry Palmer
109,2,102,"And they follow that which the devils recited against Solomons kingdom;- it was not Solomon who misbelieved, but the devils who misbelieved, teaching men sorcery,- and what has been revealed to the two angels at Babylon, Harut and Marut; yet these taught no one until they said, 'We are but a temptation, so do not misbelieve. ' Men learn from them only that by which they may part man and wife; but they can harm no one therewith, unless with the permission of God, and they learn what hurts them and profits them not. And yet they knew that he who purchased it would have no portion in the future; but sad is the price at which they have sold their souls, had they but known.",E. Henry Palmer
110,2,103,"But had they believed and feared, a reward from God were better, had they but known.",E. Henry Palmer
111,2,104,"O ye who believe! say not 'ra'hina, ' but say 'unthurna,' and hearken; for unto misbelievers shall be grievous woe.",E. Henry Palmer
112,2,105,"They who misbelieve, whether of those who have the Book or of the idolaters, would fain that no good were sent down to you from your Lord; but God specially favours with His mercy whom He will, for God is Lord of mighty grace.",E. Henry Palmer
113,2,106,"Whatever verse we may annul or cause thee to forget, we will bring a better one than it, or one like it; dost thou not know that God is mighty over all?",E. Henry Palmer
114,2,107,Dost thou not know that God's is the kingdom of the heavens and the earth? nor have ye besides God a patron or a help.,E. Henry Palmer
115,2,108,Do ye wish to question your apostle as Moses was questioned aforetime? but whoso takes misbelief in exchange for faith has erred from the level road.,E. Henry Palmer
116,2,109,"Many of those who have the Book would fain turn you back into misbelievers after ye have once believed, through envy from themselves, after the truth has been made manifest to them; but pardon and shun them till God brings His command; verily, God is mighty over all.",E. Henry Palmer
117,2,110,"Be ye steadfast in prayer, and give alms; and whatsoever good ye send before for your own souls, ye shall find it with God, for God in all ye do doth see.",E. Henry Palmer
118,2,111,"They say, 'None shall enter Paradise save such as be Jews or Christians;' that is their faith. Say thou, 'Bring your proofs, if ye be speaking truth.'",E. Henry Palmer
119,2,112,"Aye, he who resigns his face to God, and who is kind, he shall have his reward from his Lord, and no fear shall be on them, and they shall not grieve.",E. Henry Palmer
120,2,113,"The Jews say, 'The Christians rest on nought;' and the Christians say, 'The Jews rest on nought;' and yet they read the Book. So, too, say those who know not, like to what these say; but God shall judge between them on the resurrection day concerning that whereon they do dispute.",E. Henry Palmer
121,2,114,"But who is more unjust than he who prohibits God's mosques, that His name should not be mentioned there, and who strives to ruin them? 'Tis not for such to enter into them except in fear, for them is disgrace in this world, and in the future mighty woe.",E. Henry Palmer
122,2,115,"God's is the east and the west, and wherever ye turn there is God's face; verily, God comprehends and knows.",E. Henry Palmer
123,2,116,"They say, 'God takes unto Himself a son. ' Celebrated be His praise! Nay, His is what is in the heavens and the earth, and Him all things obey.",E. Henry Palmer
124,2,117,"The Originator of the heavens and the earth, when He decrees a matter He doth but say unto it, 'BE,' and it is.",E. Henry Palmer
125,2,118,"And those who do not know (the Scriptures) say, 'Unless God speak to us, or there comes a sign. ' So spake those before them like unto their speech. Their hearts are all alike. We have made manifest the signs unto a people that are sure.",E. Henry Palmer
126,2,119,"We have sent thee with the truth, a bearer of good tidings and of warning, and thou shalt not be questioned as to the fellows of hell.",E. Henry Palmer
127,2,120,"The Jews will not be satisfied with thee, nor yet the Christians, until thou followest their creed. Say, 'God's guidance is the guidance;' and if thou followest their lusts after the knowledge that has come to thee, thou hast not then from God a patron or a help.",E. Henry Palmer
128,2,121,"They to whom we have brought the Book and who read it as it should be read, believe therein; and whoso disbelieve therein, 'tis they who lose thereby.",E. Henry Palmer
129,2,122,"O children of Israel! remember my favours with which I favoured you, and that I have preferred you over the worlds.",E. Henry Palmer
130,2,123,"And fear the day when no soul shall pay a recompense for a soul, nor shall an equivalent be received therefrom, nor any intercession avail; and they shall not be helped.",E. Henry Palmer
131,2,124,"And when his Lord tried Abraham with words, and he fulfilled them, He said, 'Verily, I will set thee as a high priest for men. ' Said he, ' And of my seed?' God said, 'My covenant touches not the evildoers.'",E. Henry Palmer
132,2,125,"And when we made the House a place of resort unto men, and a sanctuary, and (said) take the station of Abraham for a place of prayer; and covenanted with Abraham and Ishmael, saying, 'Do ye two cleanse my house for those who make the circuit, for those who pay devotions there, for those who bow down, and for those too who adore. '",E. Henry Palmer
133,2,126,"When Abraham said, 'Lord, make this a town of safety, and provide the dwellers there with fruits, such as believe in God and the last day!' (God) said, ' And he who misbelieves, I will give him but little to enjoy, then will drive him to the torment of the fire, an evil journey will it be. '",E. Henry Palmer
134,2,127,"And when Abraham raised up the foundations of the House with Ishmael, 'Lord! receive it from us, verily, thou art hearing and dost know.",E. Henry Palmer
135,2,128,"Lord! and make us too resigned unto Thee, and of our seed also a nation resigned unto Thee, and show us our rites, and turn towards us, verily, Thou art easy to be turned and merciful.",E. Henry Palmer
136,2,129,"Lord! and send them an apostle from amongst themselves, to read to them Thy signs and teach them the Book and wisdom, and to purify them; verily, Thou art the mighty and the wise. '",E. Henry Palmer
