sira,sure,ayet,metin,hoca
2336,19,86,and we will drive the sinners to hell like (herds) to water!,E. Henry Palmer
2337,19,87,"They shall not possess intercession, save he who has taken a compact with the Merciful.",E. Henry Palmer
2338,19,88,"They say, 'The Merciful has taken to Himself a son:' -",E. Henry Palmer
2339,19,89,ye have brought a monstrous thing!,E. Henry Palmer
2340,19,90,"The heavens well-nigh burst asunder thereat, and the earth is riven, and the mountains fall down broken,",E. Henry Palmer
2341,19,91,that they attribute to the Merciful a son!,E. Henry Palmer
2342,19,92,"but it, becomes not the Merciful to take to Himself a son!",E. Henry Palmer
2343,19,93,there is none in the heavens or the earth but comes to the Merciful as a servant;,E. Henry Palmer
2344,19,94,"He counts them and numbers them by number,",E. Henry Palmer
2345,19,95,and they are all coming to Him on the resurrection day singly.,E. Henry Palmer
2346,19,96,"Verily, those who believe and act aright, to them the Merciful will give love.",E. Henry Palmer
2347,19,97,"We have only made it easy for thy tongue that thou mayest thereby give glad tidings to the pious, and warn thereby a contentious people.",E. Henry Palmer
2348,19,98,"How many a Generation before them have we destroyed? Canst thou find any one of them, or hear a whisper of them?",E. Henry Palmer
2349,20,1,T. H.,E. Henry Palmer
2350,20,2,We have not sent down this Qur'an to thee that thou shouldst be wretched;,E. Henry Palmer
2351,20,3,only as a reminder to him who fears -,E. Henry Palmer
2352,20,4,"descending from Him who created the earth and the high heavens,",E. Henry Palmer
2353,20,5,the Merciful settled on the throne!,E. Henry Palmer
2354,20,6,"His are what is in the heavens, and what is in the earth, and what is between the two, and what is beneath the ground!",E. Henry Palmer
2355,20,7,"And if thou art public in thy speech - yet, verily, he knows the secret, and more hidden still.",E. Henry Palmer
2356,20,8,"God, there is no god but He! His are the excellent names.",E. Henry Palmer
2357,20,9,Has the story of Moses come to thee?,E. Henry Palmer
2358,20,10,"When he saw the fire and said to his family, 'Tarry ye; verily, I perceive a fire! Haply I may bring you therefrom a brand, or may find guidance by the fire. '",E. Henry Palmer
2359,20,11,"And when he came to it he was called to, 'O Moses!",E. Henry Palmer
2360,20,12,"verily, I am thy Lord, so take off thy sandals; verily, thou art in the holy valley Tuva,",E. Henry Palmer
2361,20,13,and I have chosen thee. So listen to what is inspired thee;,E. Henry Palmer
2362,20,14,"verily, I am God, there is no god but Me! then serve Me, and be steadfast in prayer to remember Me.",E. Henry Palmer
2363,20,15,"'Verily, the hour is coming, I almost make it appear, that every soul may be recompensed for its efforts.",E. Henry Palmer
2364,20,16,"'Let not then him who believes not therein and follows his lusts ever turn thee away therefrom, and thou be ruined.",E. Henry Palmer
2365,20,17,"'What is that in thy right hand, O Moses?'",E. Henry Palmer
2366,20,18,"Said he, 'It is my staff on which I lean, and wherewith I beat down leaves for my flocks, and for which I have other uses. '",E. Henry Palmer
2367,20,19,"Said He, 'Throw it down, O Moses!'",E. Henry Palmer
2368,20,20,"and he threw it down, and behold! it was a snake that moved about.",E. Henry Palmer
2369,20,21,"Said He, 'Take hold of it and fear not; we will restore it to its first state.",E. Henry Palmer
2370,20,22,"'But press thy hand to thy side, it shall come forth white without harm, - another sign!",E. Henry Palmer
2371,20,23,to show thee of our great signs!,E. Henry Palmer
2372,20,24,"'Go unto Pharaoh, verily, he is outrageous!'",E. Henry Palmer
2373,20,25,"Said he, 'My Lord! expand for me my breast;",E. Henry Palmer
2374,20,26,and make what I am bidden easy to me;,E. Henry Palmer
2375,20,27,"and loose the knot from my tongue,",E. Henry Palmer
2376,20,28,that they may understand my speech;,E. Henry Palmer
2377,20,29,"and make for me a minister from my people, -",E. Henry Palmer
2378,20,30,Aaron my brother;,E. Henry Palmer
2379,20,31,"gird up my loins through him,",E. Henry Palmer
2380,20,32,and join him with me in the affair;,E. Henry Palmer
2381,20,33,that we may celebrate Thy praises much,E. Henry Palmer
2382,20,34,and remember Thee much.,E. Henry Palmer
2383,20,35,"'Verily, Thou dost ever behold us!'",E. Henry Palmer
2384,20,36,"He said, 'Thou art granted thy request, O Moses!",E. Henry Palmer
2385,20,37,and we have already shown favours unto thee at another time.,E. Henry Palmer
2386,20,38,"When we inspired thy mother with what we inspired her,",E. Henry Palmer
2387,20,39,"""Hurl him into the ark, and hurl him into the sea; and the sea shall cast him on the shore, and an enemy of mine and of his shall take him;"" - for on thee have I cast my love, that thou mayest be formed under my eye.",E. Henry Palmer
2388,20,40,"When thy sister walked on and said, ""Shall I guide you to one who will take charge of him?"" And we restored thee to thy mother, that her eye might be cheered and that she should not grieve. And thou didst slay a person and we saved thee from the trouble, and we tried thee with various trials. And thou didst tarry for years amongst the people of Midian; then thou didst come (hither) at (our) decree, O Moses!",E. Henry Palmer
2389,20,41,And I have chosen thee for myself.,E. Henry Palmer
2390,20,42,"Go, thou and thy brother, with my signs, and be not remiss in remembering me.",E. Henry Palmer
2391,20,43,"Go ye both to Pharaoh; verily, he is outrageous!",E. Henry Palmer
2392,20,44,"and speak to him a gentle speech, haply he may be mindful or may fear. '",E. Henry Palmer
2393,20,45,"They two said, 'Our Lord! verily, we fear that he may trespass against us, or that he may be outrageous. '",E. Henry Palmer
2394,20,46,"He said, 'Fear not; verily, I am with you twain. I hear and see!",E. Henry Palmer
2395,20,47,"'So come ye to him and say, ""Verily, we are the apostles of thy Lord; send then the children of Israel with us; and do not torment them. We have brought thee a sign from thy Lord, and peace be upon him who follows the guidance!",E. Henry Palmer
2396,20,48,"'""Verily, we are inspired that the torment will surely come upon him who calls us liars and turns his back. ""'",E. Henry Palmer
2397,20,49,"Said he, 'And who is your Lord, O Moses?'",E. Henry Palmer
2398,20,50,"He said, 'Our Lord is He who gave everything its creation, then guided it. '",E. Henry Palmer
2399,20,51,"Said he, 'And what of the former generations?'",E. Henry Palmer
2400,20,52,"He said 'The knowledge of them is with my Lord in a Book; my Lord misleads not, nor forgets!",E. Henry Palmer
2401,20,53,"Who made for you the earth a bed; and has traced for you paths therein; and has sent down from the sky water, - and we have brought forth thereby divers sorts of different vegetables.",E. Henry Palmer
2402,20,54,"Eat and pasture your cattle therefrom; verily, in that are signs to those endued with intelligence.",E. Henry Palmer
2403,20,55,"From it have we created you and into it will we send you back, and from it will we bring you forth another time. '",E. Henry Palmer
2404,20,56,"We did show him our signs, all of them, but he called them lies and did refuse.",E. Henry Palmer
2405,20,57,"Said he, 'Hast thou come to us, to turn us out of our land with thy magic, O Moses?",E. Henry Palmer
2406,20,58,"Then we will bring you magic like it; and we will make between us and thee an appointment; we will not break it, nor do thou either;-a fair place. '",E. Henry Palmer
2407,20,59,"Said he, 'Let your appointment be for the day of adornment, and let the people assemble in the forenoon. '",E. Henry Palmer
2408,20,60,"But Pharaoh turned his back, and collected his tricks, and then he came.",E. Henry Palmer
2409,20,61,"Said Moses to them, 'Woe to you! do not forge against God a lie; lest He destroy you by torment; for disappointed has ever been he who has forged. '",E. Henry Palmer
2410,20,62,And they argued their matter among themselves; and secretly talked it over.,E. Henry Palmer
2411,20,63,"Said they, 'These twain are certainly two magicians, who wish to turn you out of your land by their magic, and to remove your most exemplary doctrine.",E. Henry Palmer
2412,20,64,"Collect therefore your tricks, and then form a row; for he is prosperous today who has the upper hand. '",E. Henry Palmer
2413,20,65,"Said they, 'O Moses! either thou must throw, or we must be the first to throw. '",E. Henry Palmer
2414,20,66,"He said, 'Nay, throw ye!' and lo! their ropes and their staves appeared to move along.",E. Henry Palmer
2415,20,67,And Moses felt a secret fear within his soul.,E. Henry Palmer
2416,20,68,"Said we, 'Fear not! thou shalt have the upper hand.",E. Henry Palmer
2417,20,69,"Throw down what is in thy right hand; and it shall devour what they have made. Verily, what they have made is but a magician's trick; and no magician shall prosper wherever he comes.'",E. Henry Palmer
2418,20,70,"And the magicians were cast down in adoration; said they, 'We believe in the Lord of Aaron and of Moses!'",E. Henry Palmer
2419,20,71,"Said he, 'Do ye believe in Him before I give you leave? Verily, he is your master who taught you magic! Therefore will I surely cut off your hands and feet on alternate sides, and I will surely crucify you on the trunks of palm trees; and ye shall surely know which of us is keenest at torment and more lasting. '",E. Henry Palmer
2420,20,72,"Said they, 'We will never prefer thee to what has come to us of manifest signs, and to Him who originated us. Decide then what thou canst decide; thou canst only decide in the life of this world!",E. Henry Palmer
2421,20,73,"Verily, we believe in our Lord, that He may pardon us our sins, and the magic thou hast forced us to use; and God is better and more lasting!'",E. Henry Palmer
2422,20,74,"Verily, he who comes to his Lord a sinner,- verily, for him is hell; he shall not die therein, and shall not live.",E. Henry Palmer
2423,20,75,"But he who comes to Him a believer who has done aright - these, for them are the highest ranks,-",E. Henry Palmer
2424,20,76,"gardens of Eden beneath which rivers flow, to dwell therein for aye; for that is the reward of him who keeps pure.",E. Henry Palmer
2425,20,77,"And we inspired Moses, 'Journey by night with my servants, and strike out for them a dry road in the sea. Fear not pursuit, nor be afraid!'",E. Henry Palmer
2426,20,78,"Then Pharaoh followed them with his armies, and there overwhelmed them of the sea that which overwhelmed them.",E. Henry Palmer
2427,20,79,And Pharaoh and his people went astray and were not guided.,E. Henry Palmer
2428,20,80,O children of Israel! We have saved you from your enemy; and we made an appointment with you on the right side of the mount; and we sent down upon you the manna and the quails.,E. Henry Palmer
2429,20,81,"'Eat of the good things we have provided you with, and do not exceed therein, lest my wrath light upon you; for whomsoever my wrath lights upon he falls!",E. Henry Palmer
2430,20,82,"'Yet am I forgiving unto him who repents and believes and does right, and then is guided.",E. Henry Palmer
2431,20,83,"'But what has hastened thee on away from thy people, O Moses?'",E. Henry Palmer
2432,20,84,"He said, 'They were here upon my track and I hastened on to Thee, my Lord! that thou mightest be pleased. '",E. Henry Palmer
2433,20,85,"Said He, 'Verily, we have tried thy people, since thou didst leave, and es Samariy has led them astray. '",E. Henry Palmer
2434,20,86,"And Moses returned to his people, wrathful, grieving! Said he, 'O my, people! did not your Lord promise you a good promise? Has the time seemed too long for you, or do you desire that wrath should light on you from your Lord, that ye have broken your promise to me?'",E. Henry Palmer
2435,20,87,"They said, 'We have not broken our promise to thee of our own accord. But we were made to carry loads of the ornaments of the people, and we hurled them down, and so did es Samariy cast;",E. Henry Palmer
2436,20,88,"and he brought forth for the people a corporeal calf which lowed. ' And they said, 'This is your god and the god of Moses, but he has forgotten!'",E. Henry Palmer
2437,20,89,"What! do they not see that it does not return them any speech, and cannot control for them harm or profit?",E. Henry Palmer
2438,20,90,"Aaron too told them before, 'O my people! ye are only being tried thereby; and, verily, your Lord is the Merciful, so follow me and obey my bidding. '",E. Henry Palmer
2439,20,91,"They said, 'We will not cease to pay devotion to it until Moses come back to us. '",E. Henry Palmer
2440,20,92,"Said he, 'O Aaron! what prevented thee, when thou didst see them go astray,",E. Henry Palmer
2441,20,93,from following me? Hast thou then rebelled against my bidding?',E. Henry Palmer
2442,20,94,"Said he, 'O son of my mother! seize me not by my beard, or my head! Verily, I feared lest thou shouldst say, ""Thou hast made a division amongst the children of Israel, and hast not observed my word. ""'",E. Henry Palmer
2443,20,95,"Said he, 'What was thy design, O Samariy?'",E. Henry Palmer
2444,20,96,"Said he, 'I beheld what they beheld not, and I grasped a handful from the footprint of the messenger and cast it; for thus my soul induced me. '",E. Henry Palmer
2445,20,97,"Said he, 'Then get thee gone; verily, it shall be thine in life to say, ""Touch me not!"" and, verily, for thee there is a threat which thou shalt surely never alter. But look at thy god to which thou wert just now devout; we will surely burn it, and then we will scatter it in scattered pieces in the sea.",E. Henry Palmer
2446,20,98,"'Your God is only God who, - there is no god but He,- He embraceth everything in His knowledge. '",E. Henry Palmer
2447,20,99,"Thus do we narrate to thee the history of what has gone before, and we have brought thee a reminder from us.",E. Henry Palmer
2448,20,100,"Whoso turns therefrom, verily, he shall bear on the resurrection day a burden:-",E. Henry Palmer
2449,20,101,"for them to bear for aye, and evil for them on the resurrection day will it be to bear.",E. Henry Palmer
2450,20,102,"On the day when the trumpet shall be blown, and we will gather the sinners in that day blue-eyed.",E. Henry Palmer
2451,20,103,"They shall whisper to each other, 'Ye have only tarried ten days. '",E. Henry Palmer
2452,20,104,"We know best what they say, when the most exemplary of them in his way shall say, 'Ye have only tarried a day. '",E. Henry Palmer
2453,20,105,"They will ask thee about the mountains; say, 'My Lord will scatter them in scattered pieces,",E. Henry Palmer
2454,20,106,"and He will leave them a level plain,",E. Henry Palmer
2455,20,107,thou wilt see therein no crookedness or inequality. ',E. Henry Palmer
2456,20,108,"On that day they shall follow the caller in whom is no crookedness; and the voices shall be hushed before the Merciful, and thou shalt hear naught but a shuffling.",E. Henry Palmer
2457,20,109,"On that day shall no intercession be of any avail, save from such as the Merciful permits, and who is acceptable to Him in speech.",E. Henry Palmer
2458,20,110,"He knows what is before them and what is behind them, but they do not comprehend knowledge of Him.",E. Henry Palmer
2459,20,111,"Faces shall be humbled before the Living, the Self-subsistent; and he who bears injustice is ever lost.",E. Henry Palmer
2460,20,112,"But he who does righteous acts and is a believer, he shall fear neither wrong nor diminution.",E. Henry Palmer
2461,20,113,"Thus have we sent it down an Arabic Qur'an; and we have turned about in it the threat, - haply they may fear, or it may cause them to remember.",E. Henry Palmer
2462,20,114,"Exalted then be God, the king, the truth! Hasten not the Qur'an before its inspiration is decided for thee; but say, 'O Lord! increase me in knowledge. '",E. Henry Palmer
2463,20,115,"We did make a covenant with Adam of yore, but he forgot it, and we found no firm purpose in him.",E. Henry Palmer
2464,20,116,"And when we said to the angels, ' Adore Adam,' they adored, save Iblis, who refused.",E. Henry Palmer
2465,20,117,"And we said, 'O Adam! verily, this is a foe to thee and to thy wife; never then let him drive you twain forth from the garden or thou wilt be wretched.",E. Henry Palmer
2466,20,118,"Verily, thou hast not to be hungry there, nor naked!",E. Henry Palmer
2467,20,119,"and, verily, thou shalt not thirst therein, nor feel the noonday heat!'",E. Henry Palmer
2468,20,120,"But the devil whispered to him. Said he, 'O Adam! shall I guide thee to the tree of immortality, and a kingdom that shall not wane?'",E. Henry Palmer
2469,20,121,"And they eat therefrom, and their shame became apparent to them; and they began to stitch upon themselves some leaves of the garden; and Adam rebelled against his Lord, and went astray.",E. Henry Palmer
2470,20,122,"Then his Lord chose him, and relented towards him, and guided him.",E. Henry Palmer
2471,20,123,"Said he, 'Go down, ye twain, therefrom altogether, some of you foes to the other. And if there should come to you, from me a guidance; then whoso follows my guidance shall neither err nor be wretched.",E. Henry Palmer
2472,20,124,"But he who turns away from my reminder, verily, for him shall be a straitened livelihood; and we will gather him on the resurrection day blind!'",E. Henry Palmer
2473,20,125,"He shall say, 'My Lord! wherefore hast Thou gathered me blind when I used to see?'",E. Henry Palmer
2474,20,126,"He shall say, 'Our signs came to thee, and thou didst forget them; thus today art thou forgotten!'",E. Henry Palmer
2475,20,127,Thus do we recompense him who is extravagant and believes not in the signs of his Lord; and the torment of the hereafter is keener and more lasting!,E. Henry Palmer
2476,20,128,"Does it not occur to them how many generations we have destroyed before them?- they walk in their very dwelling-places; verily, in that are signs to those endued with intelligence.",E. Henry Palmer
2477,20,129,And had it not been for thy Lord's word already passed (the punishment) would have been inevitable and (at) an appointed time.,E. Henry Palmer
2478,20,130,"Bear patiently then what they say, and celebrate the praises of thy Lord before the rising of the sun, and before its setting, and at times in the night celebrate them; and at the ends of the day; haply thou mayest please (Him).",E. Henry Palmer
2479,20,131,"And do not strain after what we have provided a few of them with - the flourish of the life of this world, to try them by; but the provision of thy Lord is better and more lasting.",E. Henry Palmer
2480,20,132,"Bid thy people prayer, and persevere in it; we do not ask thee to provide. We will provide, and the issue shall be to piety.",E. Henry Palmer
2481,20,133,"They say, 'Unless he bring us a sign from his Lord - What! has there not come to them the manifest sign of what was in the pages of yore?'",E. Henry Palmer
2482,20,134,"But had we destroyed them with torment before it, they would have said, 'Unless Thou hadst sent to us an apostle, that we might follow Thy signs before we were abased and put to shame. '",E. Henry Palmer
2483,20,135,"Say, ' Each one has to wait, so wait ye but in the end ye shall know who are the fellows of the level way, and who are guided!'",E. Henry Palmer
2484,21,1,"Their reckoning draws nigh to men, yet in heedlessness they turn aside.",E. Henry Palmer
2485,21,2,"No reminder comes to them from their Lord of late, but they listen while they mock,",E. Henry Palmer
2486,21,3,"and their hearts make sport thereof! And those who do wrong discourse secretly (saying), 'Is this man aught but a mortal like yourselves? will ye accede to magic, while ye can see?'",E. Henry Palmer
2487,21,4,"Say, 'My Lord knows what is said in the heavens and the earth, He hears and knows!'",E. Henry Palmer
2488,21,5,"'Nay!' they say, 'a jumble of dreams; nay! he has forged it; nay! he is a poet; but let him bring us a sign as those of yore were sent. '",E. Henry Palmer
2489,21,6,No city before them which we destroyed believed - how will they believe?,E. Henry Palmer
2490,21,7,Nor did we send before them any but men whom we inspired? Ask ye the people of the Scriptures if ye do not know.,E. Henry Palmer
2491,21,8,"Nor did we make them bodies not to eat food, nor were they immortal.",E. Henry Palmer
2492,21,9,"Yet we made our promise to them good, and we saved them and whom we pleased; but we destroyed those who committed excesses.",E. Henry Palmer
2493,21,10,We have sent down to you a book in which is a reminder for you; have ye then no sense?,E. Henry Palmer
2494,21,11,"How many a city which had done wrong have we broken up, and raised up after it another people!",E. Henry Palmer
2495,21,12,And when they perceived our violence they ran away from it.,E. Henry Palmer
2496,21,13,"'Run not away, but return to what ye delighted in, and to your dwellings! haply ye will be questioned. '",E. Henry Palmer
2497,21,14,"Said they, 'O woe is us! verily, we were wrong-doers. '",E. Henry Palmer
2498,21,15,"And that ceased not to be their cry until we made them mown down, - smouldering out!",E. Henry Palmer
2499,21,16,We did not create the heaven and the earth and what is between the two in play.,E. Henry Palmer
2500,21,17,"Had we wished to take to a sport, we would have taken to one from before ourselves; had we been bent on doing so.",E. Henry Palmer
2501,21,18,"Nay, we hurl the truth against falsehood and it crashes into it, and lo! it vanishes, but woe to you for what ye attribute (to God)!",E. Henry Palmer
2502,21,19,"His are whosoever are in the heavens and the earth, and those who are with Him are not too big with pride for His service, nor do they weary.",E. Henry Palmer
2503,21,20,They celebrate His praises by night and day without intermission.,E. Henry Palmer
2504,21,21,Or have they taken gods from the earth who can raise up (the dead)?,E. Henry Palmer
2505,21,22,"Were there in both (heaven and earth) gods beside God, both would surely have been corrupted. Celebrated then be the praise of God, the Lord of the throne, above what they ascribe!",E. Henry Palmer
2506,21,23,"He shall not be questioned concerning what He does, but they shall be questioned.",E. Henry Palmer
2507,21,24,"Have they taken gods beside Him? Say, 'Bring your proofs. This is the reminder of those who are with me, and of those who were before me.' Nay, most of them know not the truth, and they do turn aside.",E. Henry Palmer
2508,21,25,"We have not sent any prophet before thee, but we inspired him that, 'There is no god but Me, so serve ye Me. '",E. Henry Palmer
2509,21,26,"And they say, 'The Merciful has taken a son; celebrated be His praise!' - Nay, honoured servants;",E. Henry Palmer
2510,21,27,they do not speak until He speaks; but at His bidding do they act.,E. Henry Palmer
2511,21,28,"He knows what is before them, and what is behind them, and they shall not intercede except for him whom He is pleased with; and they shrink through fear.",E. Henry Palmer
2512,21,29,"And whoso of them should say, 'Verily, I am god instead of Him,' such a one we recompense with hell; thus do we recompense the wrongdoers.",E. Henry Palmer
2513,21,30,"Do not those who misbelieve see that the heavens and the earth were both solid, and we burst them asunder; and we made from water every living thing - will they then not believe?",E. Henry Palmer
2514,21,31,"And we placed on the earth firm mountains lest it should move with them, and He made therein open roads for paths, haply they may be guided!",E. Henry Palmer
2515,21,32,and we made the heaven a guarded roof; yet from our signs they turn aside!,E. Henry Palmer
2516,21,33,"He it is who created the night and the day, and the sun and the moon, each floating in a sky.",E. Henry Palmer
2517,21,34,"We never made for any mortal before thee immortality; what, if thou shouldst die, will they live on for aye?",E. Henry Palmer
2518,21,35,"Every soul shall taste of death! we will test them with evil and with good, as a trial; and unto us shall they return!",E. Henry Palmer
2519,21,36,"And when those who misbelieve see thee, they only take thee for a jest, 'Is this he who mentions your gods?' Yet they at the mention of the Merciful do disbelieve.",E. Henry Palmer
2520,21,37,"Man is created out of haste. I will show, you my signs; but do not hurry Me.",E. Henry Palmer
2521,21,38,"And they say, 'When will this threat (come to pass), if ye tell the truth?'",E. Henry Palmer
2522,21,39,"Did those who misbelieve but know when the fire shall not be warded off from their faces nor from their backs, and they shall not be helped!",E. Henry Palmer
2523,21,40,"Nay, it shall come on them suddenly, and shall dumbfounder them, and they shall not be able to repel it, nor shall they be respited.",E. Henry Palmer
2524,21,41,"Prophets before thee have been mocked at, but that whereat they jested encompassed those who mocked.",E. Henry Palmer
2525,21,42,"Say, 'Who shall guard you by night and by day from the Merciful?' Nay, but they from the mention of their Lord do turn aside.",E. Henry Palmer
2526,21,43,"Have they gods to defend them against us? These cannot help themselves, nor shall they be abetted against us.",E. Henry Palmer
2527,21,44,"Nay, but we have granted enjoyment to these men and to their fathers whilst life was prolonged. Do they not see that we come to the land and shorten its borders? Shall they then prevail?",E. Henry Palmer
2528,21,45,"Say, 'I only warn you by inspiration;' but the deaf hear not the call when they are warned.",E. Henry Palmer
2529,21,46,"But if a blast of the torment of thy Lord touches them, they will surely say, 'O, woe is us! verily, we were wrong-doers!'",E. Henry Palmer
