sira,sure,ayet,metin,hoca
3990,38,20,"and we strengthened his kingdom, and we gave him wisdom and decisive address.",E. Henry Palmer
3991,38,21,Has there come to thee the story of the antagonists when they scaled the chamber wall?,E. Henry Palmer
3992,38,22,"when they entered in unto David, and he was startled at them, they said, 'Fear not, we are two antagonists; one of us has injured the other; judge then between us with the truth and be not partial, but guide us to a level way.",E. Henry Palmer
3993,38,23,"Verily, this is my brother: be had ninety-nine ewes and I had one ewe; and he said, ""Give her over to my charge;"" and he overcame me in the discourse. '",E. Henry Palmer
3994,38,24,"Said he, 'He wronged thee in asking for thy ewe in addition to his own ewes. Verily, many associates do injure one another, except those who believe and do what is right, and very few are they!' And he thought that we were trying him; and he asked pardon of his Lord and fell down bowing, and did turn;",E. Henry Palmer
3995,38,25,"and we pardoned him; for, verily, he has a near approach to us and an excellent resort.",E. Henry Palmer
3996,38,26,"O David! verily, we have made thee a vicegerent, judge then between men with truth and follow not lust, for it will lead thee astray from the path of god. Verily, those who go astray from the path of God, for them is keen torment, for that they did forget the day of reckoning!",E. Henry Palmer
3997,38,27,"And we have not created the heavens and the earth, and what is between the two, in vain. That is what those who misbelieved did think, but woe from the fire to those who misbelieve!",E. Henry Palmer
3998,38,28,Shall we make those who believe and do right like those who do evil in the earth? or shall we make the pious like the sinners?,E. Henry Palmer
3999,38,29,"A blessed Book which we have sent down to thee that they may consider its verses, and that those endowed with minds may be mindful.",E. Henry Palmer
4000,38,30,"And we gave to David, Solomon, an excellent servant; verily, he turned frequently to us.",E. Henry Palmer
4001,38,31,"When there were set before him in the evening the steeds that paw the ground,",E. Henry Palmer
4002,38,32,"and he said, 'Verily, I have loved the love of good things better than the remembrance of my Lord, until (the sun) was hidden behind the veil;",E. Henry Palmer
4003,38,33,bring them back to me;' and he began to sever their legs and necks.,E. Henry Palmer
4004,38,34,"And we did try Solomon, and we threw upon his throne a form; then he turned repentant.",E. Henry Palmer
4005,38,35,"Said he, 'My Lord, pardon me and grant me a kingdom that is not seemly for any one after me; verily, thou art He who grants!'",E. Henry Palmer
4006,38,36,And we subjected to him the wind to run on at his bidding gently wherever he directed it;,E. Henry Palmer
4007,38,37,"and the devils - every builder and diver,",E. Henry Palmer
4008,38,38,and others bound in fetters -,E. Henry Palmer
4009,38,39,"'this is our gift, so be thou lavish or withhold without account!'",E. Henry Palmer
4010,38,40,"And, verily, he had with us a near approach, and a good resort.",E. Henry Palmer
4011,38,41,And remember our servant Job when he called upon his Lord that 'the devil has touched me with toil and torment!',E. Henry Palmer
4012,38,42,"'Stamp with thy foot, this is a cool washing-place and a drink. '",E. Henry Palmer
4013,38,43,"And we granted him his family, and the like of them with them, as a mercy from us and a reminder to those endowed with minds,-",E. Henry Palmer
4014,38,44,"'and take in thy hand a bundle, and strike therewith, and break not thy oath!' Verily, we found him patient, an excellent servant; verily, he turned frequently to us.",E. Henry Palmer
4015,38,45,"And remember our servants Abraham and Isaac and Jacob, endowed with might and sight;",E. Henry Palmer
4016,38,46,"verily, we made them sincere by a sincere quality - the remembrance of the abode;",E. Henry Palmer
4017,38,47,"and, verily, they were with us of the elect, the best.",E. Henry Palmer
4018,38,48,"And remember Ishmael and Elisha and Dhu-l-kifl, for each was of the righteous.",E. Henry Palmer
4019,38,49,"This is a reminder! verily, for the pious is there an excellent resort,-",E. Henry Palmer
4020,38,50,gardens of Eden with the doors open to them;-,E. Henry Palmer
4021,38,51,reclining therein; calling therein for much fruit and drink;,E. Henry Palmer
4022,38,52,"and beside them maids of modest glance, of their own age,-",E. Henry Palmer
4023,38,53,'This is what ye were promised for the day of reckoning!' -,E. Henry Palmer
4024,38,54,"'This is surely our provision, it is never spent!'",E. Henry Palmer
4025,38,55,"This!- and, verily, for the rebellious is there an evil resort,-",E. Henry Palmer
4026,38,56,"hell; they shall broil therein, and an ill couch shall it be!",E. Henry Palmer
4027,38,57,"This, - so let them taste it!- hot water, and pus,",E. Henry Palmer
4028,38,58,and other kinds of the same sort!,E. Henry Palmer
4029,38,59,"'This is an army plunged in with you! there is no welcome for them! verily, they are going to broil in the fire!'",E. Henry Palmer
4030,38,60,"They shall say, 'Nay, for you too is there no welcome! it was ye who prepared it beforehand for us, and an ill resting-place it is!'",E. Henry Palmer
4031,38,61,"They shall say, 'Our Lord! whoso prepared this beforehand for us, give him double torment in the fire!'",E. Henry Palmer
4032,38,62,"And they shall say, 'What ails us that we do not see men whom we used to think amongst the wicked?",E. Henry Palmer
4033,38,63,whom we used to take for mockery? have our eyes escaped them?',E. Henry Palmer
4034,38,64,"Verily, that is the truth; the contention of the people of the fire.",E. Henry Palmer
4035,38,65,"Say, 'I am only a warner; and there is no god but God, the one, the victorious,",E. Henry Palmer
4036,38,66,"the Lord of the heavens and the earth, and what is between the two, the mighty, the forgiving!'",E. Henry Palmer
4037,38,67,"Say, 'It is a grand story,",E. Henry Palmer
4038,38,68,and yet ye turn from it!',E. Henry Palmer
4039,38,69,I had no knowledge of the exalted chiefs when they contended.,E. Henry Palmer
4040,38,70,I am only inspired that I am a plain warner.,E. Henry Palmer
4041,38,71,"When thy Lord said to the angels, 'Verily, I am about to create a mortal out of clay;",E. Henry Palmer
4042,38,72,"and when I have fashioned him, and breathed into him of my spirit, then fall ye down before him adoring. '",E. Henry Palmer
4043,38,73,"And the angels adored all of them,",E. Henry Palmer
4044,38,74,"save Iblis, who was too big with pride, and was of the misbelievers.",E. Henry Palmer
4045,38,75,"Said He, 'O Iblis! what prevents thee from adoring what I have created with my two hands? art thou too big with pride? or art thou amongst the exalted?'",E. Henry Palmer
4046,38,76,"Said he, 'I am better than he, Thou hast created me from fire, and him Thou hast created from clay. '",E. Henry Palmer
4047,38,77,"Said He, 'Then go forth therefrom, for, Verily, thou art pelted,",E. Henry Palmer
4048,38,78,"and, verily, upon thee is my curse unto the day of judgment. '",E. Henry Palmer
4049,38,79,"Said be, 'My Lord! then respite me until the day when they are raised. '",E. Henry Palmer
4050,38,80,"Said He, 'Then thou art amongst the respited",E. Henry Palmer
4051,38,81,until the day of the stated time. ',E. Henry Palmer
4052,38,82,"Said he, 'Then, by Thy might! I will surely seduce them all together,",E. Henry Palmer
4053,38,83,except Thy servants amongst them who are sincere!',E. Henry Palmer
4054,38,84,"Said He, 'It is the truth, and the truth I speak;",E. Henry Palmer
4055,38,85,I will surely fill hell with thee and with those who follow thee amongst them all together. ',E. Henry Palmer
4056,38,86,"Say, 'I do not ask thee for it any hire, nor am I of those who take too much upon myself.",E. Henry Palmer
4057,38,87,"It is but a reminder to the servants,",E. Henry Palmer
4058,38,88,and ye shall surely know its story after a time. ',E. Henry Palmer
4059,39,1,"The sending down of the Book from God, the mighty, the wise.",E. Henry Palmer
4060,39,2,"Verily, we have sent down to thee the Book in truth, then serve God, being sincere in religion unto Him.",E. Henry Palmer
4061,39,3,"Aye! God's is the sincere religion: and those who take beside Him patrons - 'We do not serve them save that they may bring us near to God - 'Verily, God will judge between them concerning that whereon they do dispute. Verily, God guides not him who is a misbelieving liar.",E. Henry Palmer
4062,39,4,"Had God wished to take to Himself a child, He would have chosen what He pleased from what He creates;- celebrated be His praises! He is God, the one, the victorious.",E. Henry Palmer
4063,39,5,"He created the heavens and the earth in truth! It is He who clothes the day with night; and clothes the night with day; and subjects the sun and the moon, each one runs on to an appointed time; aye! He is the mighty, the forgiving!",E. Henry Palmer
4064,39,6,"He created you from one soul; then He made from it its mate; and He sent down upon you of the cattle four pairs! He creates you in the bellies of your mothers, - creation after creation, in three darknesses. That is God for you! His is the kingdom, there is no god but He; how then can ye be turned away?",E. Henry Palmer
4065,39,7,"If ye be thankless, yet is God independent of you. He is not pleased with ingratitude in His servants; but if ye give thanks, He is pleased with that in you. But no burdened soul shall bear the burden of another; then unto your Lord is your return, and He will inform you of that which ye have done. Verily, He knows the natures of men's breasts!",E. Henry Palmer
4066,39,8,"And when distress touches a man he calls his Lord, turning repentant to Him; then when He confers on him a favour from Himself he forgets what he had called upon Him for before, and makes peers for God to lead astray from His way! Say, 'Enjoy thyself in thy misbelief a little, verily, thou art of the fellows of the Fire. '",E. Henry Palmer
4067,39,9,"Shall he who is devout throughout the night, adoring and standing, cautious concerning the hereafter, and hoping for the mercy of his Lord. . . ? Say, 'Shall those who know be deemed equal with those who know not? only those will remember, who are endowed with minds!'",E. Henry Palmer
4068,39,10,"Say, 'O my servants who believe! fear your Lord! for those who do well in this world is good, and God's earth is spacious; verily, the patient shall be paid their hire without count!'",E. Henry Palmer
4069,39,11,"Say, 'Verily, I am bidden to serve God, being sincere in religion to Him,",E. Henry Palmer
4070,39,12,and I am bidden that I be the first of those resigned. ',E. Henry Palmer
4071,39,13,"Say, 'Verily, I fear, if I rebel against my Lord, the torment of a mighty day. '",E. Henry Palmer
4072,39,14,"Say, 'God do I serve, being sincere in my relation to Him;",E. Henry Palmer
4073,39,15,"serve then what ye will beside Him!' Say, 'Verily, the losers are those who lose themselves and their families on the resurrection day. Aye, that is the obvious loss.'",E. Henry Palmer
4074,39,16,"They shall have over them shades of fire, and under them shades; with that does God frighten His servants: O my servants! then fear me.",E. Henry Palmer
4075,39,17,"But those who avoid Taghut and serve them not, but turn repentant unto God, for them shall be glad tidings. Then give glad tidings to my servants",E. Henry Palmer
4076,39,18,"who listen to the word and follow the best thereof; they it is whom God guides, and they it is who are endowed with minds.",E. Henry Palmer
4077,39,19,"Him against whom the word of torment is due, - canst thou rescue him from the fire?",E. Henry Palmer
4078,39,20,"But for those who fear their Lord for them are upper chambers, and upper chambers above them built, beneath which rivers flow; God's promise! God does not fail in His promise.",E. Henry Palmer
4079,39,21,"Hast thou not seen that God sends down from the heaven water, and conducts it into springs in the earth? then He brings forth therewith corn varied in kind, then it dries up, and ye see it grow yellow; then He makes it grit;- verily, in that is a reminder for those endowed with minds.",E. Henry Palmer
4080,39,22,"Is he whose breast God has expanded for Islam, and who is in light from his Lord. ... ? And woe to those whose hearts are hardened against a remembrance of God! those are in obvious error.",E. Henry Palmer
4081,39,23,"God has sent down the best of legends, a book uniform and repeating; whereat the skins of those who fear their Lord do creep! then their skins and their hearts soften at the remembrance of God. That is the guidance of God! He guides therewith whom He will. But he whom God leads astray there is no guide for him.",E. Henry Palmer
4082,39,24,"Shall he who must screen himself with his own face from the evil torment on the resurrection day. . . . ? And it shall be said of those who do wrong, taste what ye have earned.",E. Henry Palmer
4083,39,25,"Those before them called the (prophets) liars, and the torment came to them from whence they perceived it not;",E. Henry Palmer
4084,39,26,"and God made them taste disgrace in the life of this world. But surely the torment of the hereafter is greater, if they did but know.",E. Henry Palmer
4085,39,27,"We have struck out for men in this Qur'an every sort of parable, haply they may be mindful.",E. Henry Palmer
4086,39,28,An Arabic Qur'an with no crookedness therein; haply they may fear!,E. Henry Palmer
4087,39,29,"God has struck out a parable, a man who has partners who oppose each other and a man who is wholly given up to another; shall they be deemed equal in similitude? praise be to God! nay, but most of them know not!",E. Henry Palmer
4088,39,30,"Verily, thou shalt die, and, verily, they shall die;",E. Henry Palmer
4089,39,31,"then, verily, on the resurrection day before your Lord shall ye dispute.",E. Henry Palmer
4090,39,32,"And who is more unjust than he who lies against God, and calls the truth a lie when it comes to him? Is there not in hell a resort for those who misbelieve?",E. Henry Palmer
4091,39,33,"but whoso brings the truth and believes in it, these are they who fear.",E. Henry Palmer
4092,39,34,"For them is what they please with their Lord, that is the reward of those who do well;",E. Henry Palmer
4093,39,35,"that God may cover for them their offences which they have done, and may reward them with their hire for the best of that which they have done.",E. Henry Palmer
4094,39,36,Is not God sufficient for His servants? and yet they would frighten thee with those beside Him.,E. Henry Palmer
4095,39,37,"But he whom God leads astray there is no guide for him; and he whom God guides there is none to lead him astray: is not God mighty, the Lord of vengeance?",E. Henry Palmer
4096,39,38,"And if thou shouldst ask them who created the heavens and the earth, they will surely say, 'God!' Say, 'Have ye considered what ye call on beside God? If God wished me harm, could they remove His harm? or did He wish me mercy, could they withhold His mercy?' Say, 'God is enough for me, and on Him rely those who rely. '",E. Henry Palmer
4097,39,39,"Say, 'O my people! act according to your power; I too am going to act; and ye shall know. '",E. Henry Palmer
4098,39,40,"He to whom the torment comes it shall disgrace him, and there shall alight upon him lasting torment.",E. Henry Palmer
4099,39,41,"Verily, we have sent down to thee the Book for men in truth; and whosoever is guided it is for his own soul: but whoso goes astray it is against them, and thou art not a guardian for them.",E. Henry Palmer
4100,39,42,"God takes to Himself souls at the time of their death; and those which do not die (He takes) in their sleep; and He holds back those on whom He has decreed death, and sends others back till their appointed time;- verily, in that are signs unto a people who reflect.",E. Henry Palmer
4101,39,43,"Do they take besides God intercessors? Say, 'What! though they have no control over anything and have no sense. '",E. Henry Palmer
4102,39,44,"Say, 'God's is the intercession, all of it; His is the kingdom of the heavens and the earth; then unto Him shall ye be sent back. '",E. Henry Palmer
4103,39,45,"And when God alone is mentioned the hearts of those who believe not in the hereafter quake, and when those beside Him are mentioned, lo, they are joyful!",E. Henry Palmer
4104,39,46,"Say, 'O God! originator of the heavens and the earth, who knowest the unseen and the visible, thou wilt judge between thy servants concerning that whereon they do dispute!'",E. Henry Palmer
4105,39,47,"And had those who do wrong all that is in the earth, and the like thereof with it, they would ransom themselves therewith from the evil of the torment on the resurrection day! but there shall appear to them from God that which they had not reckoned on;",E. Henry Palmer
4106,39,48,and the evils of what they have earned shall appear to them; but that shall close in on them at which they mocked!,E. Henry Palmer
4107,39,49,"And when harm touches man he calls on us; then, when we grant him favour from us, he says, 'Verily, I am given it through knowledge!' nay, it is a trial,- but most of them do not know!",E. Henry Palmer
4108,39,50,"Those before them said it too, but that availed them not which they had earned,",E. Henry Palmer
4109,39,51,"and there befell them the evil deeds of what they had earned: and those who do wrong of these (Meccans), there shall befall them too the evil deeds of what they had earned, nor shall they frustrate Him.",E. Henry Palmer
4110,39,52,"Have they not known that God extends His provision to whom He pleases, or doles it out? verily, in that are signs unto a people who believe.",E. Henry Palmer
4111,39,53,"Say, 'O my servants! who have been extravagant against their own souls!' be not in despair of the mercy of God; verily, God forgives sins, all of them; verily, He is forgiving, merciful.",E. Henry Palmer
4112,39,54,"But turn repentant unto your Lord, and resign yourselves to Him, before there comes on you torment! then ye shall not be helped:",E. Henry Palmer
4113,39,55,"and follow the best of what has been sent down to you from your Lord, before there come on you the torment suddenly, ere ye can perceive!",E. Henry Palmer
4114,39,56,"Lest a soul should say, 'O my sighing! for what I have neglected towards God! for, verily, I was amongst those who did jest!'",E. Henry Palmer
4115,39,57,"or lest it should say, 'If God had but guided me, I should surely have been of those who fear!'",E. Henry Palmer
4116,39,58,"or lest it should say, when it sees the torment, 'Had I another turn I should be of those who do well!'",E. Henry Palmer
4117,39,59,"'Yea! there came to thee my signs and thou didst call them lies, and wert too big with pride, and wert of those who misbelieved!'",E. Henry Palmer
4118,39,60,"And on the resurrection day thou shalt see those who lied against God, with their faces blackened. Is there not in hell a resort for those who are too big with pride?",E. Henry Palmer
4119,39,61,"And God shall rescue those who fear Him, into their safe place; no evil shall touch them, nor shall they be grieved.",E. Henry Palmer
4120,39,62,"God is the creator of everything, and He is guardian over everything;",E. Henry Palmer
4121,39,63,"His are the keys of the heavens and the earth; and those who misbelieve in the signs of God, they it is who lose!",E. Henry Palmer
4122,39,64,"Say, 'What! other than God would you bid me serve, O ye ignorant ones?",E. Henry Palmer
4123,39,65,"When He has inspired thee and those before thee that, ""If thou dost associate aught with Him, thy work will surely be in vain, and thou shalt surely be of those who lose!""",E. Henry Palmer
4124,39,66,"Nay, but God do thou serve, and be of those who do give thanks!'",E. Henry Palmer
4125,39,67,"And they do not value God at His true value; while the earth all of it is but a handful for Him on the resurrection day, and the heavens shall be rolled up in His right hand! Celebrated be His praise! and exalted be He above what they associate with Him!",E. Henry Palmer
4126,39,68,"And the trumpet shall be blown, and those who are in the heavens and in the earth shall swoon, save whom God pleases. Then it shall be blown again, and, lo! they shall stand up and look on.",E. Henry Palmer
4127,39,69,"And the earth shall beam with the light of its Lord, and the Book shall be set forth, and the prophets and martyrs shall be brought; and it shall be decreed between them in truth, and they shall not be wronged!",E. Henry Palmer
4128,39,70,"And every soul shall be paid for what it has done, and He knows best that which they do;",E. Henry Palmer
4129,39,71,"and those who misbelieve shall be driven to hell in troops; and when they come there, its doors shall be opened, and its keepers shall say to them, 'Did not apostles from amongst yourselves come to you to recite to you the signs of your Lord, and to warn you of the meeting of this day of yours?' They shall say, 'Yea, but the sentence of torment was due against the misbelievers!'",E. Henry Palmer
4130,39,72,"It shall be said, 'Enter ye the gates of hell, to dwell therein for aye! Hell is the resort of those who are too big with pride!'",E. Henry Palmer
4131,39,73,"But those who fear their Lord shall be driven to Paradise in troops; until they come there, its doors shall be opened, and its keepers shall say to them, 'Peace be upon you, ye have done well! so enter in to dwell for aye!'",E. Henry Palmer
4132,39,74,"and they shall say, ' Praise be to God, who hath made good His promise to us, and hath given us the earth to inherit! We establish ourselves in Paradise wherever we please; and goodly is the reward of those who work!'",E. Henry Palmer
4133,39,75,"And thou shalt see the angels circling round about the throne, celebrating the praise of their Lord; and it shall be decided between them in truth; and it shall be said, 'Praise be to God, the Lord of the worlds!'",E. Henry Palmer
4134,40,1,'H. M.,E. Henry Palmer
4135,40,2,"The sending down of the Book from God, the mighty, the knowing,",E. Henry Palmer
4136,40,3,"the forgiver of sin and accepter of repentance, keen at punishment, longsuffering! there is no god but He! to whom the journey is!",E. Henry Palmer
4137,40,4,None wrangle concerning the signs of God but those who misbelieve; then let not their going to and fro in the cities deceive thee.,E. Henry Palmer
4138,40,5,"The people of Noah before them called the prophets liars; and the confederates after them; and every nation schemed against their Apostle to catch him. And they wrangled with falsehood that they might refute the truth thereby, but I seized them, and how was my punishment!",E. Henry Palmer
4139,40,6,"Thus was the sentence of thy Lord due against those who misbelieved, that they are the fellows of the Fire!",E. Henry Palmer
4140,40,7,"Those who bear the throne and those around it celebrate the praise of their Lord, and believe in Him, and ask pardon for those who believe: 'Our Lord! thou dost embrace all things in mercy and knowledge, then pardon those who turn repentant and follow thy way, and guard them from the torment of hell!",E. Henry Palmer
4141,40,8,"Our Lord! make them enter into gardens of Eden which thou hast promised to them, and to those who do well of their fathers, and their wives, and their seed; verily, thou art the mighty, the wise!",E. Henry Palmer
4142,40,9,"and guard them from evil deeds, for he whom thou shalt guard from evil deeds on that day, thou wilt have had mercy on, and that is mighty bliss!'",E. Henry Palmer
4143,40,10,"Verily, those who misbelieve shall be cried out to, 'Surely, God's hatred is greater than your hatred of each other when ye were called unto the faith and misbelieved!'",E. Henry Palmer
4144,40,11,"They shall say, 'Our Lord! Thou hast killed us twice, and Thou hast quickened us twice; and we do confess our sins: is there then a way for getting out?'",E. Henry Palmer
4145,40,12,"That is because when God alone was proclaimed ye did disbelieve; but when partners were joined to Him ye did believe; but judgment belongs to God, the high, the great!",E. Henry Palmer
4146,40,13,"He it is who shows you His signs, and sends down to you from heaven provision; but none is mindful except him who turns repentant;",E. Henry Palmer
4147,40,14,"then call on God, being sincere in your religion to Him, averse although the misbelievers be!",E. Henry Palmer
4148,40,15,"Exalted of degrees! The Lord of the throne! He throws the spirit by His bidding upon whom He will of His servants, to give warning of the day of meeting.",E. Henry Palmer
4149,40,16,"The day when they shall be issuing forth, naught concerning them shall be hidden from God. Whose is the kingdom on that day?- God's, the one, the dominant!",E. Henry Palmer
4150,40,17,"today shall every soul be recompensed for that which it has earned. There is no wrong today; verily, God is quick at reckoning up!",E. Henry Palmer
4151,40,18,"And warn them of the day that approaches, when hearts are choking in the gullets; those who do wrong shall have no warm friend, and no intercessor who shall be obeyed.",E. Henry Palmer
4152,40,19,"He knows the deceitful of eye and what men's breasts conceal,",E. Henry Palmer
4153,40,20,"and God decides with truth; but those they call on beside Him do not decide at all: verily, God, He both hears and looks.",E. Henry Palmer
4154,40,21,"Have, they not journeyed on in the earth and seen how was the end of those who journeyed on before them? They were stronger than them in might, and their vestiges are in the land, but God caught them up in their sins, and they had none to guard them against God.",E. Henry Palmer
