sira,sure,ayet,metin,hoca
4019,38,49,Bu bir zikirdir. Ve muhakkak ki muttakiler için güzel bir sonuç vardır.,İbni Kesir
4020,38,50,Kapıları kendilerine açılmış Adn cennetleri.,İbni Kesir
4021,38,51,Orada tahtlara yaslanmış olarak birçok meyveler ve içecekler isterler.,İbni Kesir
4022,38,52,Yanlarında gözlerini yalnız eşlerine dikmiş aynı yaştan güzeller vardır.,İbni Kesir
4023,38,53,İşte hesab günü için size vaadolunan budur.,İbni Kesir
4024,38,54,"Doğrusu bu, Bizim rızkımızdır, onun için bitip tükenme yoktur.",İbni Kesir
4025,38,55,Bu böyle. Azgınlar için de sonucun en kötüsü vardır.,İbni Kesir
4026,38,56,Cehennem. Oraya girerler. Ne kötü bir konaktır.,İbni Kesir
4027,38,57,"İşte şu, kaynar su ve irin. Tatsınlar onu.",İbni Kesir
4028,38,58,Bunlara benzer daha başkaları da vardır.,İbni Kesir
4029,38,59,"İşte bu topluluk, sizinle beraber göğüs gerenlerdir. Rahat yüzü görmesin onlar. Muhakkak cehenneme gireceklerdir.",İbni Kesir
4030,38,60,"Dediler ki: Hayır, asıl siz rahat yüzü görmeyin. Bizi buraya siz sürdünüz. Ne kötü bir duraktır burası.",İbni Kesir
4031,38,61,Dediler ki: Rabbımız; bizi buraya kim sürdüyse ona ateşteki azabını kat kat arttır.,İbni Kesir
4032,38,62,Ve dediler ki: Bizim kendilerini kötülerden saydığımız adamları niçin burada görmüyoruz?,İbni Kesir
4033,38,63,Onları alaya almıştık. Yoksa şimdi gözlere görünmez mi oldular?,İbni Kesir
4034,38,64,"İşte bu, hakkın kendisidir. Cehennem ehlinin birbiriyle tartışması.",İbni Kesir
4035,38,65,"De ki: Ben, sadece bir uyarıcıyım. Vahid, Kahhar olan Allah'tan başka hiç bir ilah yoktur.",İbni Kesir
4036,38,66,"Göklerin, yerin ve ikisinin arasında bulunanların Rabbı Aziz'dir, Gafur'dur.",İbni Kesir
4037,38,67,"De ki: Bu, büyük bir haberdir.",İbni Kesir
4038,38,68,"Ama siz, ondan yüz çeviriyorsunuz.",İbni Kesir
4039,38,69,Mele-i A'la'da olan tartışmalar hakkında benim bir bilgim yoktur.,İbni Kesir
4040,38,70,"Bana, sadece vahyolunur. Ben, ancak apaçık bir uyarıcıyım.",İbni Kesir
4041,38,71,"Hani Rabbın meleklere demişti ki: Ben, çamurdan bir insan yaratacağım.",İbni Kesir
4042,38,72,Onu yapıp ruhumdan kendisine üflediğim zaman; derhal secde edin ona.,İbni Kesir
4043,38,73,Bütün melekler topluca secde ettiler.,İbni Kesir
4044,38,74,"Yalnız İblis, büyüklük tasladı ve kafirlerden oldu.",İbni Kesir
4045,38,75,"Buyurdu ki: Ey İblis, iki elimle yarattığıma secde etmekten seni alıkoyan nedir? Böbürlendin mi, yoksa yücelerden mi oldun?",İbni Kesir
4046,38,76,"Dedi ki: Ben ondan daha hayırlıyım. Beni ateşten yarattın, onu çamurdan yarattın.",İbni Kesir
4047,38,77,"Buyurdu ki: Çık oradan. Şüphesiz sen, artık kovulmuş birisin.",İbni Kesir
4048,38,78,Ve muhakkak ki din gününe kadar la'netim senin üzerinedir.,İbni Kesir
4049,38,79,"Dedi ki: Rabbım, diriltilecekleri güne kadar beni ertele.",İbni Kesir
4050,38,80,"Buyurdu ki: Sen, şüphesiz ertelenensin,",İbni Kesir
4051,38,81,Belli bir vaktin gününe kadar.,İbni Kesir
4052,38,82,"Dedi ki: Senin izzetine yemin olsun ki ben, onların hepsini muhakkak azdırırım.",İbni Kesir
4053,38,83,Ancak içlerinden ihlasa erdirilmiş kulların müstesna.,İbni Kesir
4054,38,84,"Buyurdu ki: İşte bu, haktır ve Ben, hakkı söylerim.",İbni Kesir
4055,38,85,Muhakkak cehennemi seninle ve onlardan sana uyanların hepsiyle dolduracağım.,İbni Kesir
4056,38,86,"De ki: Ben, buna karşı sizden bir ücret istemiyorum ve ben, kendiliğimden bir şey iddia edenlerden de değilim.",İbni Kesir
4057,38,87,"Bu, ancak alemler için bir zikirdir.",İbni Kesir
4058,38,88,Onun haberini bir müddet sonra öğreneceksiniz.,İbni Kesir
4059,39,1,"Kitab'ın indirilmesi; Aziz, Hakim olan Allah katındandır.",İbni Kesir
4060,39,2,"Şüphesiz ki Biz, kitabı sana, hak olarak indirdik. Öyleyse dini Allah için tahsis ederek O'na ibadet et.",İbni Kesir
4061,39,3,"İyi bil ki; halis din, Allah'ındır. O'ndan başka veliler edinenler; onlara, sırf bizi Allah'a yaklaştırsınlar diye ibadet ediyoruz, derler. Doğrusu Allah, ihtilafa düştükleri şeylerde, aralarında hüküm verecektir. Muhakkak ki Allah; yalancı ve kafir olan kimseyi hidayete eriştirmez.",İbni Kesir
4062,39,4,"Şayet Allah, çocuk edinmek isteseydi; yaratıklarından dilediğini elbette seçerdi. Tenzih ederiz O'nu. O; Vahid ve Kahhar Allah'tır.",İbni Kesir
4063,39,5,"Gökleri ve yeri hak ile yaratmıştır. Geceyi gündüzün üzerine dolar; gündüzü de gecenin üzerine dolar. Güneşi ve ayı müsahhar kılmıştır. Her biri belirli bir süreye kadar akıp gitmektedir. İyi bilin ki O; Aziz' dir, Gaffar'dır.",İbni Kesir
4064,39,6,"Sizi bir tek nefisten yaratmış, sonra ondan eşini var etmiştir. Sizin için, hayvanlardan sekiz çift indirmiştir. Sizi, analarınızın karınlarında üç karanlık içinde, bir yaratılıştan sonra öbür yaratılışa geçirerek yaratmaktadır. İşte bu, Rabbınız olan Allah'tır. Mülk O'nundur. O'ndan başka ilah yoktur. Böyleyken nasıl olup da döndürülüyorsunuz?",İbni Kesir
4065,39,7,"Eğer küfrederseniz; muhakkak ki Allah, sizden müstağnidir. Fakat O, kulları için küfre rıza göstermez. Eğer şükrederseniz; sizden hoşnud olur. Hiç bir günahkar diğerinin günahını yüklenmez. Sonra dönüşünüz Rabbınızadır. O zaman yaptıklarınızı size haber verir. Muhakkak ki O, göğüslerin özünü bilendir.",İbni Kesir
4066,39,8,"İnsana bir sıkıntı dokunduğu zaman Rabbına yönelerek O'na yalvarır. Sonra O, kendi katından ona bir nimet verince; önceden O'na yalvarmış olduğunu unutuverir. Ve Allah'ın yolundan saptırmak için O'na eşler koşar. De ki: Küfrünle biraz eğlenedur. Muhakkak ki sen, ateş yaranındansın.",İbni Kesir
4067,39,9,"Yoksa o, geceleyin secde ederek, kıyamda durarak itaat eden, ahiretten korkan ve Rabbının rahmetini dileyen kimse gibi midir? De ki: Hiç bilenlerle bilmeyenler bir olur mu? Doğrusu ancak akıl sahipleri öğüt alıp düşünür.",İbni Kesir
4068,39,10,"De ki: Ey iman eden kullarım, Rabbınızdan korkun. Bu dünyada iyilik yapanlara, iyilik vardır. Ve Allah'ın arzı geniştir. Yalnız sabredenlere ecirleri, hesapsız ödenecektir.",İbni Kesir
4069,39,11,"De ki: Ben, dini yalnız Allah'a tahsis ederek ibadet etmekle emrolundum.",İbni Kesir
4070,39,12,"Ve ben, müslümanların ilki olmakla emrolundum.",İbni Kesir
4071,39,13,De ki: Rabbıma karşı gelirsem; doğrusu büyük günün azabından korkarım.,İbni Kesir
4072,39,14,"De ki: Ben, dinimde muhlis olarak Allah'a ibadet ederim.",İbni Kesir
4073,39,15,"Artık siz de O'ndan başka dilediğinize tapın. De ki: Hüsrana uğrayanlar; kıyamet gününde kendilerini de, ailelerini de hüsrana uğratanlardır. İyi bilin ki; apaçık hüsran işte budur.",İbni Kesir
4074,39,16,"Onların üstlerinde kat kat ateşler, altlarında kat kat ateşler vardır. Allah, kullarını bununla korkutur. Ey kullarım, benden korkun.",İbni Kesir
4075,39,17,Tağut'a tapmaktan kaçınıp Allah'a yönelenlere; işte onlara müjde vardır. Öyleyse kullarımı müjdele.,İbni Kesir
4076,39,18,"Onlar ki; sözü dinlerler de, en güzeline uyarlar. İşte bunlar; Allah'ın kendilerini hidayete eriştirdiği kimselerdir. Ve işte bunlar; akıl sahiblerinin kendileridir.",İbni Kesir
4077,39,19,Hakkında azab hükmü gerçekleşmiş kimseyi mi? Ateşte olanı sen mi kurtaracaksın?,İbni Kesir
4078,39,20,"Fakat Rabblarından korkanlar için, üzerlerine konaklar yapılmış, altlarında ırmaklar akan yüksek menziller vardır. Bu, Allah'ın verdiği sözdür. Allah, verdiği sözden caymaz.",İbni Kesir
4079,39,21,"Görmez misin ki; gerçekten Allah, gökten bir su indirip onu yerdeki kaynaklara yerleştirmiş, sonra da onunla türlü türlü ekinler çıkarmaktadır. Sonra onları kurutur ve sen, onları sararmış görürsün. Sonra da onu çörçöp haline çevirir. Muhakkak ki bunlarda, akıl sahipleri için ibret vardır.",İbni Kesir
4080,39,22,"Allah, kimin göğsünü İslam'a açmışsa; artık o, Rabbından bir nur üzeredir. Allah'ın zikrinden kalbleri katılaşmış olanların vay haline. İşte onlar, apaçık bir sapıklık içindedirler.",İbni Kesir
4081,39,23,"Allah, sözün en güzelini; ahenkli, ikişerli bir kitab halinde indirmiştir. Rabblarından korkanların ondan derileri ürperir. Sonra hem derileri hem de kalbleri Allah'ın zikrine karşı yumuşar. Bu, Allah'ın hidayet rehberidir, onunla istediğini hidayete eriştirir. Allah kimi de saptırırsa; ona bir daha yol gösteren bulunmaz.",İbni Kesir
4082,39,24,"Zalimlere: Kazandıklarınızın karşılığını tadın, denilirken kıyamet günü yüzünü azabın kötüsünden kim koruyacak?",İbni Kesir
4083,39,25,Onlardan öncekiler de peygamberleri yalanlamışlardı da hiç farkında olmadıkları bir yönden azab kendilerine çatıvermişti.,İbni Kesir
4084,39,26,"Allah, dünya hayatında onlara rüsvaylığı tattırdı. Ahiret azabı ise daha büyüktür. Keşki bilselerdi.",İbni Kesir
4085,39,27,"Andolsun ki; Biz, bu Kur'an'da insanlara her çeşit misali verdik. Belki öğüt alırlar.",İbni Kesir
4086,39,28,Eğriliği bulunmayan arabça bir Kur'an'dır. Belki sakınırlar.,İbni Kesir
4087,39,29,"Allah, bir misal verir: Bir adamın, huysuz ve birbirleriyle ortak birkaç efendisi var. Bir adamın da tek bir efendisi var. Bu ikisi bir olur mu hiç? Hamd; Allah'a mahsustur; ama onların çoğu bilmezler.",İbni Kesir
4088,39,30,"Şüphesiz sen de öleceksin, onlar da ölecekler.",İbni Kesir
4089,39,31,"Sonra siz, kıyamet günü Rabbınızın huzurunda duruşmaya çıkacaksınız.",İbni Kesir
4090,39,32,Allah'a karşı yalan söyleyenden ve kendisine gelmiş olan gerçeği yalan sayandan daha zalim kimdir? Kafirler için cehennemde bir karargah olmaz olur mu?,İbni Kesir
4091,39,33,Doğruyu getiren ve onu tasdik edenler; işte onlar muttakilerdir.,İbni Kesir
4092,39,34,"Rabbları katında diledikleri her şey, onlarındır. Bu, ihsan edenlerin mükafatıdır.",İbni Kesir
4093,39,35,Çünkü Allah; onların yaptıklarının en kötüsünü örtecek ve yapmakta olduklarının en güzeliyle karşılığını verecektir.,İbni Kesir
4094,39,36,"Allah, kuluna kafi değil mi? Seni O'ndan başkalarıyla korkutuyorlar. Allah, kimi saptırırsa; onu hidayete erdirecek yoktur.",İbni Kesir
4095,39,37,"Allah, kimi de hidayete erdirirse; onu saptıracak yoktur. Allah; Aziz, intikam sahibi değil midir?",İbni Kesir
4096,39,38,"Andolsun ki; onlara: Gökleri ve yeri yaratan kimdir? diye sorsan; muhakkak, Allah'tır, diyecekler. De ki: Öyleyse söyleyin bakalım; Allah, bana bir zarar vermek istese, O'nu bırakıp da taptıklarınız O'nun verdiği zararı giderebilir mi? Yahut bana bir rahmet dilerse, O'nun rahmetini önleyebilir mi? De ki: Allah, bana yeter. Tevekkül edenler O'na tevekkül ederler.",İbni Kesir
4097,39,39,De ki: Ey kavmim; elinizden geleni yapın. Doğrusu ben de yapacağım. Ve yakında bileceksiniz.,İbni Kesir
4098,39,40,"Kendisine rüsvay edici bir azab gelecek olan kim, üzerine sürekli azab inecek olan kim?",İbni Kesir
4099,39,41,"Şüphesiz ki Biz; kitabı sana insanlar için hak olarak indirdik. Kim hidayete ererse; bu, kendi lehinedir. Kim de sapıtırsa; kendi aleyhine sapıtmış olur. Ve sen, onların üzerinde vekil değilsin.",İbni Kesir
4100,39,42,"Allah; ölüm anında canları alır. Ölmeyenin ise uykusunda. Ölmelerine hükmettiği kimselerinkini tutar, diğerlerini belli bir süreye kadar salıverir. Doğrusu bunda; düşünen bir kavim için ayetler vardır.",İbni Kesir
4101,39,43,"Yoksa onlar; Allah'tan başka şefaatçılar mı edindiler? De ki: Onlar, hiç bir şeye güç getiremez ve akıl erdiremez olsalar da mı?",İbni Kesir
4102,39,44,De ki: Bütün şefaat Allah'ındır. Göklerin ve yerin mülkü O'nundur. Sonra hepiniz O'na döndürüleceksiniz.,İbni Kesir
4103,39,45,"Allah, tek başına anıldığı zaman; ahirete inanmayanların kalbleri tiksinir. Ama O'ndan başkaları anıldığı vakit hemen yüzleri güler.",İbni Kesir
4104,39,46,"De ki: Ey gökleri ve yeri yaratan, görülmeyeni ve görüleni bilen Allah'ım; ayrılığa düştükleri şeyler hakkında kulların arasında Sen hükmedersin.",İbni Kesir
4105,39,47,Yeryüzünde olanların hepsi ve bir misli daha zalimlerin olsaydı; kıyamet günündeki kötü azab için elbette bunları fidye verirlerdi. Halbuki Allah katından onlara hiç hesablamadıkları şeyler belirmiştir.,İbni Kesir
4106,39,48,"İşledikleri kötülükler onlara belli olmuş, alaya aldıkları şeyler de kendilerini çepeçevre sarmıştır.",İbni Kesir
4107,39,49,"İnsana bir sıkıntı gelince; Bize yalvarır. Sonra katımızdan ona bir nimet verdiğimizde; bu, bana bilgimden dolayı verilmiştir, der. Hayır, bu bir denemedir. Fakat çokları bilmezler.",İbni Kesir
4108,39,50,"Onlardan öncekiler de bunu söylemişlerdi. Ama kazandıkları şey, kendilerine bir fayda vermemişti.",İbni Kesir
4109,39,51,Böylece kazandıkları kötülükler başlarına geldi. Bunların içinden zulmedenlerin kazandıkları kötülükler de kendilerini çarpacaktır. Ve onlar aciz bırakılacaklar da değillerdir.,İbni Kesir
4110,39,52,"Bilmezler mi ki; Allah, dilediğine rızkı genişletir ve kısar. Doğrusu bunda, inanan kimseler için ayetler vardır.",İbni Kesir
4111,39,53,"De ki: Ey kendi nefislerine karşı aşırı davranan kullarım, Allah'ın rahmetinden ümidinizi kesmeyin. Muhakkak ki Allah; günahları bağışlar. Çünkü O; Gafur'dur, Rahim'dir",İbni Kesir
4112,39,54,Ve Rabbınıza yönelin. Size azab gelmeden önce O'na teslim olun. Sonra yardım edilmezsiniz.,İbni Kesir
4113,39,55,"Siz, farkında değilken ansızın azab gelmezden önce Rabbınızdan size indirilen sözün en güzeline uyun.",İbni Kesir
4114,39,56,"Kişinin: Allah'a karşı aşırı gitmemden dolayı vay bana, yazıklar olsun; gerçekten ben, alaya alanlardandım, diyeceği gün gelmezden önce.",İbni Kesir
4115,39,57,"Veya: Allah beni hidayete erdirseydi, ben de muttakilerden olurdum, diyeceği gün.",İbni Kesir
4116,39,58,"Yahut azabı gördüğü vakit: Keşki benim için bir dönüş daha olsaydı da ihsan edenlerden olsaydım, diyeceği gün.",İbni Kesir
4117,39,59,"Hayır, sana ayetlerim gelmişti de, onları yalanlamış, büyüklük taslayarak kafirlerden olmuştun.",İbni Kesir
4118,39,60,Ve kıyamet günü Allah'a karşı yalan uyduranların yüzlerinin simsiyah olduğunu görürsün. Mütekebbir için cehennemde bir karargah olmaz olur mu?,İbni Kesir
4119,39,61,"Allah muttakileri, kurtuluşlarına sebep olan ile selamete erdirir. Onlara hiç bir kötülük gelmez ve üzülmezler de.",İbni Kesir
4120,39,62,Allah; her şeyin yaratanıdır ve O; her şeye vekildir.,İbni Kesir
4121,39,63,Göklerin ve yerin anahtarları O'nundur. Allah'ın ayetlerine küfredenler; işte onlar hüsrana uğrayanlardır.,İbni Kesir
4122,39,64,"De ki: Bana, Allah'tan başkasına ibadet etmemi mi emredersiniz ey cahiller?",İbni Kesir
4123,39,65,"Andolsun; sana da, senden öncekilere de vahyolunmuştur ki: Eğer Allah'a ortak koşarsan, şüphesiz amellerin boşa gider ve muhakkak hüsrana uğrayanlardan olursun.",İbni Kesir
4124,39,66,"Hayır, yalnız Allah'a ibadet et ve şükredenlerden ol.",İbni Kesir
4125,39,67,"Onlar Allah'ı şanına yaraşır şekilde takdir edemediler. Halbuki kıyamet günü bütün yeryüzü O'nun avucundadır. Gökler de O'nun sağ eliyle dürülmüştür. O; koştukları ortaklardan münezzehtir, yücedir.",İbni Kesir
4126,39,68,"Ve Sur'a üflenmiştir. Artık Allah'ın dilediği bir yana, göklerde olanlar ve yerde olanlar baygın düşmüştür. Sonra ona bir daha üflenmiş ve bir de bakacaksın ki ayakta bakınıp duruyorlar.",İbni Kesir
4127,39,69,"Yer; Rabbının nuru ile aydınlandı, kitab konuldu, peygamberler ve şahidler getirildi. Onlara haksızlık yapılmadan aralarında hak ile hükmolundu.",İbni Kesir
4128,39,70,Her kişiye ne yaptıysa eksiksiz ödendi. Ve Allah; onların yaptıklarını en iyi bilendir.,İbni Kesir
4129,39,71,"Küfredenler bölük bölük cehenneme sürüldü. Oraya vardıklarında kapıları açıldı ve bekçileri onlara dediler ki: İçinizden, size Rabbınızın ayetlerini okuyan ve bugüne kavuşacağınızı ihtar eden elçiler gelmedi mi? Onlar da: Evet, dediler. Fakat azab sözü küfredenlerin üzerine hak oldu.",İbni Kesir
4130,39,72,Onlara denildi ki: İçinde temelli kalacağınız cehennemin kapılarından girin. Büyüklenenlerin durağı ne kötüdür.,İbni Kesir
4131,39,73,"Rabblarından sakınanlar ise fevc fevc cennete götürüldüler. Oraya varıp da kapıları açılınca, bekçileri onlara dediler ki: Selam olsun size. Hoş geldiniz. Temelli olarak girin buraya.",İbni Kesir
4132,39,74,Onlar da dediler ki: Bize vaadinde sadık olan ve bizi yeryüzüne varis kılan Allah'a hamdolsun. Cennette istediğimiz yerde oturabiliriz. Çalışanların ecri ne de güzeldir.,İbni Kesir
4133,39,75,Görürsün ki; melekler de Rabblarına hamd ile tesbih ederek Arş'ın etrafını kuşatmışlardır. Artık onların arasında hak ile hükmolunmuştur ve denildi ki: Hamd olsun alemlerin Rabbı Allah'a.,İbni Kesir
4134,40,1,"Ha, Mim.",İbni Kesir
4135,40,2,"Kitab'ın indirilişi; Aziz, Alim olan Allah'tandır.",İbni Kesir
4136,40,3,"Günahları bağışlayan, tevbeyi kabul eden, cezası şiddetli, lutfu bol olandır. O'ndan başka ilah yoktur, dönüş O'nadır.",İbni Kesir
4137,40,4,Küfredenlerden başkası Allah'ın ayetleri üzerinde tartışmaya girişmez. Öyleyse onların şehirlerde dönüp dolaşması seni aldatmasın.,İbni Kesir
4138,40,5,Onlardan önce Nuh kavmi de yalanladı. Arkalarından muhtelif topluluklar da. Her ümmet kendi peygamberlerini yakalamaya yeltendi ve hakkı batılla yok etmek için mücadeleye girişti. En sonunda Ben de onları yakaladım. Azabım nasılmış?,İbni Kesir
4139,40,6,Böylece küfredenlerin cehennemlik olduklarına dair Rabbının sözü gerçekleşti.,İbni Kesir
4140,40,7,"Arş'ı taşıyanlar ve çevresinde bulunanlar Rabblarını hamd ile tesbih ederler, O'na inanırlar ve mü'minlerin yarlığanmasını isterler: Rabbımız; ilim ve rahmetle her şeyi kuşattın. Tevbe edip Senin yoluna uyanları bağışla. Ve onları cehennem azabından koru.",İbni Kesir
4141,40,8,"Rabbımız; onları ve babalarından, eşlerinden, soylarından salih olanları kendilerine vaadettiğin Adn cennetlerine girdir. Şüphesiz ki Aziz, Hakim olan Sensin Sen.",İbni Kesir
4142,40,9,Onları kötülüklerden koru. O gün kötülüklerden kimi korursan; şüphesiz ona rahmet etmiş olursun. En büyük kurtuluş işte budur,İbni Kesir
4143,40,10,"Muhakkak küfredenlere seslenilir ki: Allah'ın gazabı sizin birbirinize öfkenizden daha büyüktür. Çünkü siz, imana davet olunuyordunuz da küfrediyordunuz.",İbni Kesir
4144,40,11,"Onlar da: Rabbımız; bizi iki defa öldürdün, iki defa dirilttin. Biz de suçlarımızı itiraf ettik. Bir daha çıkmaya yol var mı? derler.",İbni Kesir
4145,40,12,"Bunun sebebi şudur: Yalnız Allah'a dua edildiği zaman inkar ederdiniz de, O'na şirk koşulunca inanırdınız. Artık hüküm; Aliyy, Kebir Allah'ındır.",İbni Kesir
4146,40,13,Size ayetlerini gösteren ve sizin için gökten rızık indiren O'dur. O'na yönelenden başkası ibret almaz.,İbni Kesir
4147,40,14,"Öyleyse kafirler istemese de, siz dini yalnız O'na halis kılanlar olarak Allah'a dua edin.",İbni Kesir
4148,40,15,"Dereceleri yükselten, Arş'ın sahibi Allah, karşılaşma gününden korkutmak için, kendi emrinden olan ruhu kullarından dilediğine indirir.",İbni Kesir
4149,40,16,"O gün onlar, ortaya çıkarlar. Hiç bir şeyleri Allah'a gizli kalmaz. Kimindir bugün mülk? Vahid, Kahhar olan Allah'ındır.",İbni Kesir
4150,40,17,Bugün her nefis kazandığı ile karşılık görür. Bugün zulüm yoktur. Muhakkak ki Allah; hesabı çabuk görendir.,İbni Kesir
4151,40,18,"Onları yaklaşan gün ile uyar. O zaman ki; yürekler ağızlara gelecek, tasadan yutkunacaklar. Zalimlerin ne dostu, ne de dinlenecek şefaatçısı olur.",İbni Kesir
4152,40,19,O; gözlerin hainliğini ve göğüslerin gizlediğini bilir.,İbni Kesir
4153,40,20,"Allah; hak ile hükmeder. O'nu bırakıp da taptıkları ise hiç bir şeye hükmedemez. Şüphesiz ki Allah; Semi'dir, Basir'dir.",İbni Kesir
4154,40,21,Yeryüzünde gezip dolaşmadılar mı ki; kendilerinden öncekilerin akıbetlerinin nasıl olduğunu görsünler? Onlar; kendilerinden daha kuvvetli ve yeryüzünde daha çok eser bırakan kimselerdi. Allah; onları günahlarıyla yakalayıverdi. Allah'a karşı onları koruyan yoktur.,İbni Kesir
4155,40,22,"Bu; peygamberleri kendilerine apaçık mucizelerle geldiğinde inkar etmelerindendir. Allah da onları yakalayıverdi. Muhakkak ki O; kuvvetlidir, cezalandırması pek şiddetlidir.",İbni Kesir
4156,40,23,"Andolsun ki; Biz, Musa'yı ayetlerimizle ve apaçık burhan ile gönderdik.",İbni Kesir
4157,40,24,"Firavun'a, Haman'a ve Karun'a. Bu, yalancı sihirbazın biridir, dediler.",İbni Kesir
4158,40,25,"O, katımızdan kendilerine hakkı getirince: Onunla beraber iman etmiş olanların oğullarını öldürün, kadınlarını sağ bırakın, dediler. Kafirlerin düzeni hedef olmaktan başka bir şey değildir.",İbni Kesir
4159,40,26,"Firavun demişti ki: Bırakın beni de Musa'yı öldüreyim. O ise Rabbına yalvaradursun. Onun, sizin dininizi değiştirmesinden veya yeryüzünde fesad çıkarmasından korkuyorum.",İbni Kesir
4160,40,27,"Musa da demişti ki: Doğrusu ben, hesab gününe inanmayan her mütekebbirden ; benim de Rabbım, sizin de Rabbınız olana sığınırım.",İbni Kesir
4161,40,28,"Firavun hanedanından olup da imanını gizleyen mü'min bir adam da demiştir ki: Rabbım Allah'tır, dedi diye bir kişiyi mi öldüreceksiniz? Halbuki o, size Rabbınızdan ayetlerle gelmiştir. Eğer yalancıysa; yalanı kendisinedir. Eğer doğru sözlü ise; sizi tehdit ettiklerinin bir kısmı başınıza gelebilir. Muhakkak ki Allah; haddi aşan yalancı bir kimseyi hidayete erdirmez.",İbni Kesir
4162,40,29,"Ey kavmim; bugün mülk sizindir. Yeryüzünde galib sizsiniz. Fakat Allah' ın baskını gelip çatınca, O'na karşı bize kim yardım eder? Firavun dedi ki: Ben, size kendi görüşümden başkasını söylemiyorum. Size doğru yolun tersini de göstermiyorum.",İbni Kesir
4163,40,30,"İnanmış olan dedi ki: Ey kavmim; doğrusu ben, sizin hakkınızda peygamberleri yalanlayan toplulukların uğradıkları bir günün benzerinden korkuyorum.",İbni Kesir
4164,40,31,"Nuh kavminin, Ad, Semud ve onlardan sonra gelenlerin durumu gibi. Allah, kullarına zulüm dilemez.",İbni Kesir
4165,40,32,"Ey kavmim; doğrusu ben, sizin için o feryad gününden endişe ediyorum.",İbni Kesir
4166,40,33,"Arkanıza dönüp kaçacağınız gün, sizi Allah'a karşı koruyan bulunmaz. Allah, kimi saptırırsa; onu doğru yola getirecek yoktur.",İbni Kesir
4167,40,34,"Andolsun ki; daha önce Yusuf da size apaçık burhanlarla gelmişti. O zaman da size getirdiği şeylerden şüphelenip durmuştunuz. Nihayet vefat edince: Allah, bundan sonra hiç bir peygamber göndermez, demiştiniz. İşte Allah; haddi aşan aşırı şüphecileri böyle şaşırtır.",İbni Kesir
4168,40,35,"Onlar ki; kendilerine gelmiş bir huccet bulunmaksızın Allah'ın ayetleri üzerinde tartışırlar. Bu, Allah katında da, iman edenlerin yanında da öfkeyi arttırır. Ve böylece Allah; büyüklük taslayan her zorbanın kalbini mühürler.",İbni Kesir
4169,40,36,Firavun demişti ki: Ey Haman; bana yüksek bir kule yap. Belki o yollara ulaşabilirim.,İbni Kesir
4170,40,37,"Göklerin yollarına. Musa'nın tanrısını görürüm. Doğrusu ben, onu yalancı sanıyorum. Böylece yaptığı kötü iş Firavun'a güzel gösterildi de doğru yoldan alıkonuldu. Firavun'un düzeni elbette boşa gidecekti.",İbni Kesir
4171,40,38,"İnanmış olan demişti ki: Ey kavmim; bana uyun, sizi doğru yola hidayet edeyim.",İbni Kesir
4172,40,39,"Ey kavmim; şüphesiz dünya hayatı geçici bir geçinmedir. Ahiret ise doğrusu işte o, asıl kalınacak yurd odur.",İbni Kesir
4173,40,40,"Kim, bir kötülük işlerse; ancak onun benzerleriyle ceza görür. Kadın veya erkek her kim de inanarak salih amel işlerse; işte onlar, cennete girerler ve orada hesapsız şekilde rızıklanırlar.",İbni Kesir
4174,40,41,"Ey kavmim; bana ne oluyor ki, sizi kurtuluşa çağırırken, siz beni; ateşe çağırıyorsunuz.",İbni Kesir
4175,40,42,"Siz, beni; Allah'a küfretmem, hiç tanımadığım nesneleri O'na ortak tutmam için çağırıyorsunuz. Ben ise, sizi Aziz ve Gaffar'a çağırıyorum.",İbni Kesir
4176,40,43,"Şüphesiz sizin beni kendisine çağırdığınız; bu dünyada da, ahirette de çağırabilecek kabiliyette değildir. Ve muhakkak dönüşümüz Allah'adır. Elbette müsrifler; işte onlardır cehennem yaranı olanlar.",İbni Kesir
4177,40,44,"Size söylediğimi hatırlayacaksınız. Ben, işimi Allah'a bırakıyorum. Muhakkak ki Allah; kulları görendir.",İbni Kesir
4178,40,45,"Allah; onu, kurmak istedikleri tuzakların fenalıklarından korudu ve Firavun'un adamlarını azabın kötüsü kuşatıverdi.",İbni Kesir
4179,40,46,"Sabah akşam ateşe sunulurlar. Kıyamet koptuğu gün; Firavun'un adamlarını azabın en şiddetlisine sokun, denir.",İbni Kesir
4180,40,47,"Ateşin içinde birbirleriyle tartışırlarken güçsüzler, büyüklük taslayanlara derler ki: Doğrusu biz, size uymuştuk. Şimdi ateşin bir parçasını olsun bizden savabilir misiniz?",İbni Kesir
4181,40,48,"Büyüklük taslayanlar: Doğrusu hepimiz, onun içindeyiz. Şüphesiz Allah kullar arasında hükmünü vermiştir, derler.",İbni Kesir
